### ISSUE TITLE
Full tcpdump for "Unable to measure latency to server'

### ISSUE THREAD

**Issue by richb-hanover** [Zoxc/crusader#26]
This is a companion to #22. It contains a full tcpdump of the traffic between client and source that generates the "Unable to measure latency to server" error. The server works fine if tested on IPv6 address `fd7e:5a1e:b4b3::98a`; it gives the error below if tested at `fd7e:5a1e:b4b3::d35`.

The experiment:

Client: running on `fd7e:5a1e:b4b3:0:5758:451:6e8b:a707`
```
deploy@RPi5:~/Documents/src/crusader/src/target/release$ ./crusader test fd7e:5a1e:b4b3::d35
[2024.08.01 06:48:19] Client version 0.0.11-udp-spawn running
[2024.08.01 06:48:19] Connected to server [fd7e:5a1e:b4b3::d35]:35481
thread 'main' panicked at crusader-lib/src/test.rs:1369:10:
called `Result::unwrap()` on an `Err` value: "Unable to measure latency to server"
note: run with `RUST_BACKTRACE=1` environment variable to display a backtrace
Aborted (core dumped)
```
Server: running on `fd7e:5a1e:b4b3::d35` (note: `fd7e:5a1e:b4b3::98a` works fine)
```
deploy@rpi4:~/src/crusader/src/target/release$ ./crusader serve
[2024.07.31 15:36:43] Server version 0.0.11-udp-spawn running...
[2024.07.31 15:36:58] Serving [fd7e:5a1e:b4b3:0:5758:451:6e8b:a707]:57326, version 3
[2024.07.31 15:37:20] Serving complete for [fd7e:5a1e:b4b3:0:5758:451:6e8b:a707]:57326
[2024.07.31 15:37:30] Serving [fd7e:5a1e:b4b3:0:5758:451:6e8b:a707]:45420, version 3
[2024.07.31 15:37:53] Serving complete for [fd7e:5a1e:b4b3:0:5758:451:6e8b:a707]:45420
[2024.07.31 15:38:04] Serving [fd7e:5a1e:b4b3:0:5758:451:6e8b:a707]:46762, version 3
[2024.07.31 15:38:05] Error from client [fd7e:5a1e:b4b3:0:5758:451:6e8b:a707]:46762: Expected object
[2024.07.31 15:38:16] Serving [fd7e:5a1e:b4b3:0:5758:451:6e8b:a707]:36458, version 3
[2024.07.31 15:38:18] Error from client [fd7e:5a1e:b4b3:0:5758:451:6e8b:a707]:36458: Expected object
[2024.08.01 06:47:26] Serving [fd7e:5a1e:b4b3:0:5758:451:6e8b:a707]:42990, version 3
[2024.08.01 06:47:28] Error from client [fd7e:5a1e:b4b3:0:5758:451:6e8b:a707]:42990: Expected object
[2024.08.01 06:48:19] Serving [fd7e:5a1e:b4b3:0:5758:451:6e8b:a707]:49012, version 3
[2024.08.01 06:48:20] Error from client [fd7e:5a1e:b4b3:0:5758:451:6e8b:a707]:49012: Expected object
```
tcpdump: Started several seconds before the Crusader run; excluding only port 22 (my SSH connection)
```
deploy@rpi4:~$ sudo tcpdump -i eth0 -n port not 22
[sudo] password for deploy:
tcpdump: verbose output suppressed, use -v[v]... for full protocol decode
listening on eth0, link-type EN10MB (Ethernet), snapshot length 262144 bytes
06:48:15.488548 78:8c:b5:ce:2f:d9 > ff:ff:ff:ff:ff:ff, RRCP-0x25 query

06:48:16.244560 IP 192.168.253.102.38257 > 255.255.255.255.7423: UDP, length 173
06:48:16.489790 78:8c:b5:ce:2f:d9 > ff:ff:ff:ff:ff:ff, RRCP-0x25 query
06:48:17.492888 78:8c:b5:ce:2f:d9 > ff:ff:ff:ff:ff:ff, RRCP-0x25 query
06:48:18.151811 IP6 fe80::804:ded6:5131:ea3d > ff02::16: HBH ICMP6, multicast listener report v2, 1 group record(s), length 28
06:48:18.151946 IP 192.168.253.167 > 224.0.0.2: igmp leave 224.0.0.251
06:48:18.152066 IP 192.168.253.167 > 224.0.0.251: igmp v2 report 224.0.0.251
06:48:18.152735 IP 192.168.253.167.5353 > 224.0.0.251.5353: 0 [4q] PTR (QU)? _homekit._tcp.local. PTR (QU)? _rdlink._tcp.local. PTR (QU)? _companion-link._tcp.local. PTR (QU)? _sleep-proxy._udp.local. (97)
06:48:18.152879 IP6 fe80::804:ded6:5131:ea3d.5353 > ff02::fb.5353: 0 [4q] PTR (QU)? _homekit._tcp.local. PTR (QU)? _rdlink._tcp.local. PTR (QU)? _companion-link._tcp.local. PTR (QU)? _sleep-proxy._udp.local. (97)
06:48:18.490806 78:8c:b5:ce:2f:d9 > ff:ff:ff:ff:ff:ff, RRCP-0x25 query
06:48:19.045857 IP6 fd7e:5a1e:b4b3::d35.35481 > fd7e:5a1e:b4b3:0:5758:451:6e8b:a707.49012: Flags [S.], seq 1510339975, ack 928023641, win 64260, options [mss 1440,sackOK,TS val 2925147721 ecr 1373475114,nop,wscale 7], length 0
06:48:19.047810 IP6 fd7e:5a1e:b4b3::d35.35481 > fd7e:5a1e:b4b3:0:5758:451:6e8b:a707.49012: Flags [.], ack 25, win 502, options [nop,nop,TS val 2925147722 ecr 1373475125], length 0
06:48:19.048126 IP6 fd7e:5a1e:b4b3::d35.35481 > fd7e:5a1e:b4b3:0:5758:451:6e8b:a707.49012: Flags [P.], seq 1:25, ack 25, win 502, options [nop,nop,TS val 2925147723 ecr 1373475125], length 24
06:48:19.050103 IP6 fd7e:5a1e:b4b3::d35.35481 > fd7e:5a1e:b4b3:0:5758:451:6e8b:a707.49012: Flags [P.], seq 25:46, ack 37, win 502, options [nop,nop,TS val 2925147725 ecr 1373475127], length 21
06:48:19.053227 IP6 fd7e:5a1e:b4b3::98a.35481 > fd7e:5a1e:b4b3:0:5758:451:6e8b:a707.36877: UDP, length 16
06:48:19.053333 IP6 fd7e:5a1e:b4b3::d35.35481 > fd7e:5a1e:b4b3:0:5758:451:6e8b:a707.49012: Flags [P.], seq 46:82, ack 49, win 502, options [nop,nop,TS val 2925147728 ecr 1373475129], length 36
06:48:19.054314 IP6 fd7e:5a1e:b4b3:0:5758:451:6e8b:a707 > fd7e:5a1e:b4b3::98a: ICMP6, destination unreachable, unreachable port, fd7e:5a1e:b4b3:0:5758:451:6e8b:a707 udp port 36877, length 72
06:48:19.063310 IP6 fd7e:5a1e:b4b3::98a.35481 > fd7e:5a1e:b4b3:0:5758:451:6e8b:a707.36877: UDP, length 16
06:48:19.064199 IP6 fd7e:5a1e:b4b3:0:5758:451:6e8b:a707 > fd7e:5a1e:b4b3::98a: ICMP6, destination unreachable, unreachable port, fd7e:5a1e:b4b3:0:5758:451:6e8b:a707 udp port 36877, length 72
```

Why is this an issue? It was initially discovered because I was using the DNS name `rpi4.lan`, which failed half the time. It turns out that mDNS has assigned two IPv6 addresses to that name on that host (see `dig` below), and was returning alternating addresses. 

```
deploy@RPi5:~/Documents/src/crusader/src/target/release$ dig any @192.168.253.1 rpi4.lan

; <<>> DiG 9.18.28-0ubuntu0.24.04.1-Ubuntu <<>> any @192.168.253.1 rpi4.lan
; (1 server found)
;; global options: +cmd
;; Got answer:
;; ->>HEADER<<- opcode: QUERY, status: NOERROR, id: 37647
;; flags: qr aa rd ra; QUERY: 1, ANSWER: 3, AUTHORITY: 0, ADDITIONAL: 1

;; OPT PSEUDOSECTION:
; EDNS: version: 0, flags:; udp: 1232
;; QUESTION SECTION:
;rpi4.lan.			IN	ANY

;; ANSWER SECTION:
rpi4.lan.		0	IN	A	192.168.253.225
rpi4.lan.		0	IN	AAAA	fd7e:5a1e:b4b3::d35
rpi4.lan.		0	IN	AAAA	fd7e:5a1e:b4b3::98a

;; Query time: 2 msec
;; SERVER: 192.168.253.1#53(192.168.253.1) (TCP)
;; WHEN: Thu Aug 01 06:43:33 EDT 2024
;; MSG SIZE  rcvd: 109
```

**Comment by Zoxc** [comment]
That's not behaving consistent with my `udp-spawn` branch. On the server, try to run `cargo clean` in `src` and update to the latest `master`.

**Comment by richb-hanover** [comment]
OK. I'll do that now. I'll update to latest `master`, then run `cargo clean` on both and rebuild.

**Comment by richb-hanover** [comment]
It looks as if #22 is solved, so I am closing this.
