### ISSUE TITLE
Release version gives error; debug version (and gui) work perfectly

### ISSUE THREAD

**Issue by richb-hanover** [Zoxc/crusader#38]
I'm moving this issue from #30 to here...

Update: Using 3eb0a37 on macOS 12.7.5, I build with `cargo build`. Both the `crusader-gui` and debug version of `crusader test` work as expected. 

The release version of `crusader test` gives the log messages below. What other troubleshooting info could I provide?
```
?1 release % RUST_BACKTRACE=1 ./crusader test 192.168.253.225
[2024-08-09 15:24:42] Client version 0.1.0-dev (commit 3eb0a372546ea7d2a8e14238e48f0cce92e64c89) running
[2024-08-09 15:24:43] Connected to server 192.168.253.225:35481
[2024-08-09 15:24:43] Client failed
Error: Protocol handshake

Caused by:
    0: Receiving hello
    1: Failed to receive object
    2: Socket is not connected (os error 57)

Stack backtrace:
   0: __mh_execute_header
   1: __mh_execute_header
```

Crusader Server `0.0.12` shows:

```
deploy@rpi4:~/src/crusader/src/target/release$ ./crusader serve
[2024-08-08 23:06:59] Server version 0.0.12 running...
[2024-08-08 23:21:32] Serving 192.168.253.118:65329, version 3
[2024-08-08 23:21:32] Starting UDP server (192.168.253.225)
[2024-08-08 23:21:55] Serving complete for 192.168.253.118:65329
[2024-08-08 23:22:18] Serving 192.168.253.118:65400, version 3
[2024-08-08 23:22:42] Serving complete for 192.168.253.118:65400
[2024-08-08 23:23:06] Serving 192.168.253.118:65467, version 3
[2024-08-08 23:23:28] Serving complete for 192.168.253.118:65467
[2024-08-08 23:23:43] Serving 192.168.253.118:65533, version 3
[2024-08-08 23:24:06] Serving complete for 192.168.253.118:65533
[2024-08-09 15:21:49] Error from client 192.168.253.118:56287: Expected object
[2024-08-09 15:22:10] Serving 192.168.253.118:56292, version 3
[2024-08-09 15:22:32] Serving complete for 192.168.253.118:56292
[2024-08-09 15:23:38] Serving 192.168.253.118:56439, version 3
[2024-08-09 15:24:01] Serving complete for 192.168.253.118:56439
[2024-08-09 15:24:29] Error from client 192.168.253.118:56523: Expected object
[2024-08-09 15:24:43] Error from client 192.168.253.118:56530: Expected object
```

`crusader test` (debug version) shows:

```
√ src % cd target/debug;./crusader test 192.168.253.225
[2024-08-09 15:23:31] Client version 0.1.0-dev (commit 3eb0a372546ea7d2a8e14238e48f0cce92e64c89) running
[2024-08-09 15:23:31] Connected to server 192.168.253.225:35481
[2024-08-09 15:23:40] Idle latency to server 2.00 ms
[2024-08-09 15:23:41] Testing download...
[2024-08-09 15:23:47] Testing upload...
[2024-08-09 15:23:54] Testing both download and upload...
[2024-08-09 15:24:01] Writing data...
[2024-08-09 15:24:01] Saved raw data as crusader-results/data 2024-08-09 15.24.01.crr
[2024-08-09 15:24:02] Saved plot as crusader-results/plot 2024-08-09 15.24.01.png
```

`crusader-gui` shows a similar successful test (I didn't save it).

**Comment by Zoxc** [comment]
I'd try to capture some packets with Wireshark to see what happens network wise on TCP 35481. It looks like the socket immediately disconnects for some reason.

**Comment by Zoxc** [comment]
You may also try `debug-assertions = true` under `[profile.release]`, then `opt-level = 0`.

**Comment by richb-hanover** [comment]
Making those changes to _src/Cargo.toml_ had no effect - the "release" version fails with the same RUST_BACKTRACE; the "debug" version works as expected.

> It looks like the socket immediately disconnects for some reason...

I think there's a hint here... Two builds work: the "debug" build and the GUI build. What could cause the "release" build to work differently?

Thanks.

**Comment by Zoxc** [comment]
`debug-assertions` is the main difference between the profiles. You could give `cargo clean` + `rustup update` a try and see if that changes behavior here.

**Comment by richb-hanover** [comment]
There is no change after `cargo clean` and `rustup update`

**Comment by richb-hanover** [comment]
Additional info: Building on a M2 Mac mini, both `crusader test ...` and `crusader-gui` work as expected.

```
richb@Mac-mini2 release % >....
[2024-08-09 21:06:02] Client version 0.1.0-dev (commit 3eb0a372546ea7d2a8e14238e48f0cce92e64c89) running
[2024-08-09 21:06:02] Connected to server 192.168.253.225:35481
[2024-08-09 21:06:04] Idle latency to server 0.46 ms
[2024-08-09 21:06:05] Testing download...
[2024-08-09 21:06:11] Testing upload...
[2024-08-09 21:06:17] Testing both download and upload...
[2024-08-09 21:06:24] Writing data...
[2024-08-09 21:06:24] Saved raw data as crusader-results/data 2024-08-09 21.06.24.crr
[2024-08-09 21:06:24] Saved plot as crusader-results/plot 2024-08-09 21.06.24.png
richb@Mac-mini2 release % ./crusader-gui
[Client] [2024-08-09 21:07:09] Client version 0.1.0-dev (commit 3eb0a372546ea7d2a8e14238e48f0cce92e64c89) running
[Client] [2024-08-09 21:07:23] Client version 0.1.0-dev (commit 3eb0a372546ea7d2a8e14238e48f0cce92e64c89) running
[Client] [2024-08-09 21:07:23] Connected to server 192.168.253.225:35481
[Client] [2024-08-09 21:07:25] Idle latency to server 0.43 ms
[Client] [2024-08-09 21:07:26] Testing download...
[Client] [2024-08-09 21:07:32] Testing upload...
[Client] [2024-08-09 21:07:38] Testing both download and upload...
[Client] [2024-08-09 21:08:05] Client version 0.1.0-dev (commit 3eb0a372546ea7d2a8e14238e48f0cce92e64c89) running
[Client] [2024-08-09 21:08:05] Connected to server 192.168.253.225:35481
[Client] [2024-08-09 21:08:07] Idle latency to server 0.42 ms
[Client] [2024-08-09 21:08:08] Testing download...
[Client] [2024-08-09 21:08:14] Testing upload...
[Client] [2024-08-09 21:08:20] Testing both download and upload...
richb@Mac-mini2 release %
```

**Comment by richb-hanover** [comment]
TCPDump taken from server end... (Client command on 192.168.253.118 was `./crusader test 192.168.253.225`)

```
deploy@rpi4:~$ sudo !!
sudo tcpdump -i eth0  host 192.168.253.225 and not port 22
tcpdump: verbose output suppressed, use -v[v]... for full protocol decode
listening on eth0, link-type EN10MB (Ethernet), snapshot length 262144 bytes

21:27:58.720726 ARP, Request who-has rpi4 tell Belkin-RT3200.lan, length 46
21:27:58.720791 ARP, Reply rpi4 is-at e4:5f:01:e2:b7:b0 (oui Unknown), length 28
21:28:04.000651 IP rpi4.22000 > discovery-3.syncthing.net.3478: UDP, length 32
21:28:04.101823 IP rpi4.22000 > discovery-3.syncthing.net.3478: UDP, length 32
21:28:04.255737 IP discovery-3.syncthing.net.3478 > rpi4.22000: UDP, length 68
21:28:04.356701 IP discovery-3.syncthing.net.3478 > rpi4.22000: UDP, length 68
21:28:08.453267 IP 192.168.253.118.59365 > rpi4.35481: Flags [S], seq 2544042829, win 65535, options [mss 1460,nop,wscale 6,nop,nop,TS val 1268886219 ecr 0,sackOK,eol], length 0
21:28:08.453494 IP rpi4.35481 > 192.168.253.118.59365: Flags [S.], seq 3908057720, ack 2544042830, win 65160, options [mss 1460,sackOK,TS val 2625562285 ecr 1268886219,nop,wscale 7], length 0
21:28:08.454808 IP 192.168.253.118.59365 > rpi4.35481: Flags [.], ack 1, win 2058, options [nop,nop,TS val 1268886227 ecr 2625562285], length 0
21:28:08.474061 IP 192.168.253.118.59365 > rpi4.35481: Flags [F.], seq 1, ack 1, win 2058, options [nop,nop,TS val 1268886246 ecr 2625562285], length 0
21:28:08.474265 IP rpi4.35481 > 192.168.253.118.59365: Flags [F.], seq 1, ack 2, win 510, options [nop,nop,TS val 2625562306 ecr 1268886246], length 0
21:28:08.475551 IP 192.168.253.118.59365 > rpi4.35481: Flags [.], ack 2, win 2058, options [nop,nop,TS val 1268886248 ecr 2625562306], length 0
21:28:08.758698 IP rpi4.45432 > dogpound.me.22067: Flags [.], ack 4176438414, win 501, options [nop,nop,TS val 1055813257 ecr 335569253], length 0
21:28:08.773914 IP dogpound.me.22067 > rpi4.45432: Flags [.], ack 1, win 502, options [nop,nop,TS val 335584357 ecr 1055798362], length 0
21:28:08.968017 IP dogpound.me.22067 > rpi4.45432: Flags [.], ack 1, win 502, options [nop,nop,TS val 335584553 ecr 1055798362], length 0
21:28:08.968198 IP rpi4.45432 > dogpound.me.22067: Flags [.], ack 1, win 501, options [nop,nop,TS val 1055813466 ecr 335584357], length 0
21:28:12.628463 IP 192.168.253.6 > rpi4: ICMP echo request, id 208, seq 18, length 32
21:28:12.628623 IP rpi4 > 192.168.253.6: ICMP echo reply, id 208, seq 18, length 32
^C
18 packets captured
18 packets received by filter
0 packets dropped by kernel
```

**Comment by Zoxc** [comment]
Have you tried earlier Crusader versions? And also the pre-built releases?

What's the OS version for the M2 Mac Mini?

**Comment by richb-hanover** [comment]
The Mac mini is running macOS Sonoma 14.5

The pre-built release of 0.0.12 (crusader-x86_64-apple-darwin) works as expected.

Building my own version using f55dc8a ("Bump version"), I get this error:

```
release % RUST_BACKTRACE=1 ./crusader test 192.168.253.225
[2024-08-09 22:31:54] Client version 0.0.12 running
[2024-08-09 22:31:54] Connected to server 192.168.253.225:35481
[2024-08-09 22:31:54] Client failed: Socket is not connected (os error 57)
```

**Comment by richb-hanover** [comment]
PS I feel terrible about this problem: I don't know enough about Rust development to offer any insights so I just have to "be your hands" on my computer.

To make sure I'm doing effective experiments, let me ask a couple questions

* `cargo build --release` only builds binaries in the _target/release_ directory, right?
* `cargo build` seems only to build a binary in _target/debug_ - true?

Thanks.

**Comment by richb-hanover** [comment]
One more (confusing) thought... I am quite sure that I built versions based on 0.0.12 and subsequent commits that all worked just fine. (In fact, I know this is the case because I could make a follow-on build as noted in #22.)

I don't have good records or a clear memory of when I first saw this behavior. I may not have reported it immediately because I was focused on GUI stuff instead...

I'm also not aware of any changes to my OS environment (Rust, etc) that would affect this. Sorry

**Comment by Zoxc** [comment]
I do know a lot about Rust development and I don't have much in the way of insights either. It kind of looks like both an miscompilation and an OS error.

> * `cargo build --release` only builds binaries in the _target/release_ directory, right?
> * `cargo build` seems only to build a binary in _target/debug_ - true?

Correct. You can also do `cargo run -p crusader --release -- test <server>` to avoid mixups.

You could also try 
```
[profile.dev]
debug-assertions = false
opt-level = 3
panic = "abort"
```
to see if we can trigger it on the debug builds.

For a curveball, how about `cargo run --profile speed -p crusader -- test <server>`?

**Comment by Zoxc** [comment]
You could also try this
```
[profile.release]
panic = "abort"
strip = "none"
debug-assertions = false
opt-level = 0
incremental = true
overflow-checks = true
codegen-units = 256
```
Making the release profile as close to debug as possible. If it works, you can revert back options line by line.

**Comment by richb-hanover** [comment]
I made those changes to _crusader/src/Cargo.toml_ with no change in behavior. Just to be sure I'm doing it right, this is my current file:

```
[workspace]
members = ["crusader", "crusader-lib", "crusader-gui-lib", "crusader-gui"]
resolver = "1"

[profile.dev]
panic = "abort"

[profile.release]
panic = "abort"
strip = "none"
debug-assertions = false
opt-level = 0
incremental = true
overflow-checks = true
codegen-units = 256

[profile.speed]
opt-level = 3
codegen-units = 1
inherits = "release"
lto = "fat"

[profile.size]
inherits = "speed"
opt-level = "z"
```

**Comment by richb-hanover** [comment]
**Wacky thought:** We are spending a lot of time working on a problem that may only affect me (at least, no one else is reporting trouble). I have no need to continue building these releases on my own: I'll be happy to continue using the pre-built `0.1.0` when it ships.

The differences between the "release" and "debug" versions are small. I can't speak to performance differences, but their binary sizes are comparable:

```
# release
-rwxr-xr-x     1 richb  staff    19M Aug 10 08:09 crusader
-rwxr-xr-x     1 richb  staff    25M Aug 10 08:09 crusader-gui

# debug
-rwxr-xr-x     1 richb  staff    33M Aug 10 08:11 crusader
-rwxr-xr-x     1 richb  staff    43M Aug 10 08:11 crusader-gui
```

**My proposal:** Just ship the current "debug" build as the official/release build. The minor increase in size might not warrant a lot more effort to track this down. Thanks for listening.

**Comment by richb-hanover** [comment]
@Zoxc **Update:** The above suggestion (release with all the debugging info included) is my back-handed way of saying that `0.1.0` is **so** much better than 0.012 that we should definitely ship it.

1. It works better
2. It has better set of options
3. It has better documentation
4. It has better logging

Unless you have minor tweaks to add, I would recommend that you bundle up `0.1.0` and let the world play with it. Thanks again for listening.

**Comment by Zoxc** [comment]
> I made those changes to crusader/src/Cargo.toml with no change in behavior. Just to be sure I'm doing it right, this is my current file:

I got the `debug-assertions` flag wrong. It should be true.
```
[profile.release]
panic = "abort"
strip = "none"
debug-assertions = true
opt-level = 0
incremental = true
overflow-checks = true
codegen-units = 256
```
If that change doesn't reproduce it. I'd try swapping the executable paths.

> The above suggestion (release with all the debugging info included) is my back-handed way of saying that 0.1.0 is so much better than 0.012 that we should definitely ship it.

There's a bug on Android where you need to double touch to focus I'd like fixed first.

**Comment by richb-hanover** [comment]
I agree. You definitely should fix other problems as needed. My suggestion only wanted to point out that this bug (#38) doesn't need to hold up the release.

NB I changed _src/Cargo.toml_ to use the `[profile.release]` shown above, then built with `cargo build --release` and encountered the same error. Here's the log

Finally, I am not sure what you mean by "swapping the executable paths..."

Thanks

```
?1 release % RUST_BACKTRACE=1 ./crusader test 192.168.253.225
[2024-08-11 20:26:09] Client version 0.1.0-dev (commit fad7f446599ac7eadd8e1d357c1f37e2e6de003c) running
[2024-08-11 20:26:09] Connected to server 192.168.253.225:35481
[2024-08-11 20:26:10] Client failed
Error: Protocol handshake

Caused by:
    0: Receiving hello
    1: Failed to receive object
    2: Socket is not connected (os error 57)

Stack backtrace:
   0: std::backtrace_rs::backtrace::libunwind::trace
             at /rustc/3f5fd8dd41153bc5fdca9427e9e05be2c767ba23/library/std/src/../../backtrace/src/backtrace/libunwind.rs:116:5
   1: std::backtrace_rs::backtrace::trace_unsynchronized
             at /rustc/3f5fd8dd41153bc5fdca9427e9e05be2c767ba23/library/std/src/../../backtrace/src/backtrace/mod.rs:66:5
   2: std::backtrace::Backtrace::create
             at /rustc/3f5fd8dd41153bc5fdca9427e9e05be2c767ba23/library/std/src/backtrace.rs:331:13
   3: std::backtrace::Backtrace::capture
             at /rustc/3f5fd8dd41153bc5fdca9427e9e05be2c767ba23/library/std/src/backtrace.rs:296:9
```

**Comment by Zoxc** [comment]
> Finally, I am not sure what you mean by "swapping the executable paths..."

Copy the binary from `/target/release` to `/target/debug` and vice versa.

**Comment by richb-hanover** [comment]
Oh, this is peculiar... Moving the "release" binary to the "debug" directory 'causes' it to work. Moving the debug binary to the release directory also works...

```
# copy from src/target/release to the debug directory
# Run the release build in its directory - it fails
?1 release % ./crusader test 192.168.253.225 
[2024-08-11 21:33:40] Client version 0.1.0-dev (commit 87344bbaf95b12f6de9d52a20295b455272e07d1) running
[2024-08-11 21:33:40] Connected to server 192.168.253.225:35481
[2024-08-11 21:33:40] Client failed
Error: Protocol handshake

Caused by:
    0: Receiving hello
    1: Failed to receive object
    2: Socket is not connected (os error 57)

# Copy the release build to the debug directory and cd there
?1 release % cp ./crusader ../debug/crusader-release
√ release % cd ../debug

# This time that same binary works...
√ debug % RUST_BACKTRACE=1 ./crusader-release test  192.168.253.225
[2024-08-11 21:34:48] Client version 0.1.0-dev (commit 87344bbaf95b12f6de9d52a20295b455272e07d1) running
[2024-08-11 21:34:48] Connected to server 192.168.253.225:35481
[2024-08-11 21:34:50] Idle latency to server 1.68 ms
[2024-08-11 21:34:51] Testing download...
[2024-08-11 21:34:57] Testing upload...
[2024-08-11 21:35:03] Testing both download and upload...
[2024-08-11 21:35:15] Warning: Load termination timed out. There may be residual untracked traffic in the background.
[2024-08-11 21:35:15] Writing data...
[2024-08-11 21:35:15] Saved raw data as crusader-results/data 2024-08-11 21.35.15.crr
[2024-08-11 21:35:15] Saved plot as crusader-results/plot 2024-08-11 21.35.15.png
```

`./cargo-release test 192.168.253.225` works fine from the "debug" directory. So does copying the debug binary to the "release" directory and executing it...

**Comment by Zoxc** [comment]
It might be time to update macOS versions.

**Comment by richb-hanover** [comment]
I would be reluctant to do this. Here's another thought: perhaps my build environment is screwed up. 

Would you produce a pre-built version of the current dev `0.1.0` version for macOS? Thanks

**Comment by Zoxc** [comment]
Maybe there's some firewall rules for the release build path?

https://github.com/Zoxc/crusader/releases/tag/v0.1-dev

**Comment by richb-hanover** [comment]
Huzzah! The pre-built version of 0.1 worked perfectly. I am willing to declare this problem is peculiar to my machine.

```
?1 crusader-x86_64-apple-darwin-0.1.0 % ./crusader test 192.168.253.225
[2024-08-12 13:42:31] Client version 0.1.0-dev (commit 87344bbaf95b12f6de9d52a20295b455272e07d1) running
[2024-08-12 13:42:31] Connected to server 192.168.253.225:35481
[2024-08-12 13:42:32] Idle latency to server 1.79 ms
[2024-08-12 13:42:33] Testing download...
[2024-08-12 13:42:39] Testing upload...
[2024-08-12 13:42:46] Testing both download and upload...
[2024-08-12 13:42:52] Writing data...
[2024-08-12 13:42:52] Saved raw data as crusader-results/data 2024-08-12 13.42.52.crr
[2024-08-12 13:42:52] Saved plot as crusader-results/plot 2024-08-12 13.42.52.png
```
Unless you think there's something interesting to learn, I'll close this. Thanks!

PS I do not believe there are any firewall rules that could affect this. 

a) I don't have per-directory firewall rules, although I do use Little Snitch
b) It worked just fine when I built versions a couple weeks ago. (See, for example, #22...)
