### ISSUE TITLE
[SOLVED] Using IPv6 alternates between successful test and crash

### ISSUE THREAD

**Issue by richb-hanover** [Zoxc/crusader#22]
This may be related to #9, but I think there are minor differences. I have two Raspberry Pi computers running Crusader server and client (version 0.0.11 on both). Both are connected by Ethernet to my router's LAN switch ports.

- RPi4 - Ubuntu 22.04.4 LTS - running the server
- RPi5 - Ubuntu 24.04 LTS - running the client

Here's what I saw:

1. Start the server on RPi4 with `./crusader serve`
2. Start the client on RPi5 with `./crusader test IPv4-address-of RPi4` This works as expected - every time.
3. Start the client on RPi5 with `./crusader test RPi4.lan` This finds the **IPv6** address for RPi4
4. The first time, it connects, but the client gives this error message:
   ```
   [2024.07.30 11:56:51] Client version 0.0.11 running
   [2024.07.30 11:56:52] Connected to server [fd7e:5a1e:b4b3::d35]:35481
   thread 'main' panicked at crusader-lib/src/test.rs:1369:10:
   called `Result::unwrap()` on an `Err` value: "Unable to measure latency to server"
   note: run with `RUST_BACKTRACE=1` environment variable to display a backtrace
   Aborted (core dumped)
   ```
6. The server gives this message:
   ```
   [2024.07.30 15:55:56] Server version 0.0.11 running...
   [2024.07.30 15:56:52] Serving [fd7e:5a1e:b4b3:0:aca8:e98c:5918:f3d9]:37032, version 3
   [2024.07.30 15:56:53] Error from client [fd7e:5a1e:b4b3:0:aca8:e98c:5918:f3d9]:37032: Expected object
   ```
7. _BUT_ the next time I used `./crusader test RPi4.lan`, it worked as expected.
8. Then started a pattern of failure (like step 4 above) followed by success (step 7), repeatable for many times through that loop.

I append a copy of the two terminal sessions. What other diagnostic info could I provide?  Thanks.

PS Thanks for the enhanced logging info - it makes these reports easier to understand!

```
========= RPi4 - Ubuntu 22.04.4 LTS ========

deploy@rpi4:~/src/crusader/src/target/release$ ./crusader serve
[2024.07.30 12:21:19] Server version 0.0.11 running...
[2024.07.30 12:21:30] Serving [fd7e:5a1e:b4b3:0:aca8:e98c:5918:f3d9]:57322, version 3
[2024.07.30 12:21:31] Error from client [fd7e:5a1e:b4b3:0:aca8:e98c:5918:f3d9]:57322: Expected object
[2024.07.30 12:21:47] Serving [fd7e:5a1e:b4b3:0:aca8:e98c:5918:f3d9]:54702, version 3
[2024.07.30 12:22:14] Serving complete for [fd7e:5a1e:b4b3:0:aca8:e98c:5918:f3d9]:54702
[2024.07.30 12:22:22] Serving [fd7e:5a1e:b4b3:0:aca8:e98c:5918:f3d9]:56348, version 3
[2024.07.30 12:22:23] Error from client [fd7e:5a1e:b4b3:0:aca8:e98c:5918:f3d9]:56348: Expected object
[2024.07.30 12:22:29] Serving [fd7e:5a1e:b4b3:0:aca8:e98c:5918:f3d9]:46936, version 3
[2024.07.30 12:22:52] Serving complete for [fd7e:5a1e:b4b3:0:aca8:e98c:5918:f3d9]:46936
[2024.07.30 12:22:55] Serving [fd7e:5a1e:b4b3:0:aca8:e98c:5918:f3d9]:50614, version 3
[2024.07.30 12:22:57] Error from client [fd7e:5a1e:b4b3:0:aca8:e98c:5918:f3d9]:50614: Expected object
[2024.07.30 12:23:01] Serving [fd7e:5a1e:b4b3:0:aca8:e98c:5918:f3d9]:36046, version 3
[2024.07.30 12:23:23] Serving complete for [fd7e:5a1e:b4b3:0:aca8:e98c:5918:f3d9]:36046
[2024.07.30 12:23:26] Serving [fd7e:5a1e:b4b3:0:aca8:e98c:5918:f3d9]:33694, version 3
[2024.07.30 12:23:27] Error from client [fd7e:5a1e:b4b3:0:aca8:e98c:5918:f3d9]:33694: Expected object




========== RPi5 - Ubuntu 24.04 LTS ========

deploy@RPi5:~/Documents/src/crusader/src/target/release$ ./crusader test rpi4.lan
[2024.07.30 12:21:30] Client version 0.0.11 running
[2024.07.30 12:21:30] Connected to server [fd7e:5a1e:b4b3::d35]:35481
thread 'main' panicked at crusader-lib/src/test.rs:1369:10:
called `Result::unwrap()` on an `Err` value: "Unable to measure latency to server"
note: run with `RUST_BACKTRACE=1` environment variable to display a backtrace
Aborted (core dumped)
deploy@RPi5:~/Documents/src/crusader/src/target/release$ ./crusader test rpi4.lan
[2024.07.30 12:21:47] Client version 0.0.11 running
[2024.07.30 12:21:47] Connected to server [fd7e:5a1e:b4b3::98a]:35481
[2024.07.30 12:21:48] Latency to server 1.14 ms
[2024.07.30 12:21:50] Testing download...
[2024.07.30 12:21:56] Testing upload...
[2024.07.30 12:22:02] Testing both download and upload...
[2024.07.30 12:22:14] Warning: Load termination timed out. There may be residual untracked traffic in the background.
[2024.07.30 12:22:14] Writing data...
[2024.07.30 12:22:14] Saved raw data as data 2024.07.30 12-22-14.crr
[2024.07.30 12:22:14] Saved plot as plot 2024.07.30 12-22-14.png
deploy@RPi5:~/Documents/src/crusader/src/target/release$ ./crusader test rpi4.lan
[2024.07.30 12:22:22] Client version 0.0.11 running
[2024.07.30 12:22:22] Connected to server [fd7e:5a1e:b4b3::d35]:35481
thread 'main' panicked at crusader-lib/src/test.rs:1369:10:
called `Result::unwrap()` on an `Err` value: "Unable to measure latency to server"
note: run with `RUST_BACKTRACE=1` environment variable to display a backtrace
Aborted (core dumped)
deploy@RPi5:~/Documents/src/crusader/src/target/release$ ./crusader test rpi4.lan
[2024.07.30 12:22:29] Client version 0.0.11 running
[2024.07.30 12:22:29] Connected to server [fd7e:5a1e:b4b3::98a]:35481
[2024.07.30 12:22:31] Latency to server 1.27 ms
[2024.07.30 12:22:33] Testing download...
[2024.07.30 12:22:39] Testing upload...
[2024.07.30 12:22:45] Testing both download and upload...
[2024.07.30 12:22:52] Writing data...
[2024.07.30 12:22:52] Saved raw data as data 2024.07.30 12-22-52.crr
[2024.07.30 12:22:52] Saved plot as plot 2024.07.30 12-22-52.png
```

**Comment by Zoxc** [comment]
Could you run `tcpdump` on the server side to see if the UDP pings arrive with the expected IP and if there are any replies?

**Comment by richb-hanover** [comment]
Failing tcpdump attached - started with `sudo tcpdump -i eth0 port 35481`. I also have a successful trace (about 1.6mbytes, but you probably know what that looks like...)

Thanks!

```
31Jul2024 Server side (rpi4) - FAILED

Client log:
./crusader test rpi4.lan
[2024.07.31 07:36:10] Client version 0.0.11 running
[2024.07.31 07:36:11] Connected to server [fd7e:5a1e:b4b3::d35]:35481
thread 'main' panicked at crusader-lib/src/test.rs:1369:10:
called `Result::unwrap()` on an `Err` value: "Unable to measure latency to server"
note: run with `RUST_BACKTRACE=1` environment variable to display a backtrace
Aborted (core dumped)

Server log:
deploy@rpi4:~/src/crusader/src/target/release$ ./crusader serve
[2024.07.31 07:22:06] Server version 0.0.11 running...
[2024.07.31 07:22:29] Serving 192.168.253.154:55974, version 3
[2024.07.31 07:22:57] Serving complete for 192.168.253.154:55974
[2024.07.31 07:24:12] Serving 192.168.253.154:49658, version 3
[2024.07.31 07:24:34] Serving complete for 192.168.253.154:49658
[2024.07.31 07:26:08] Serving [fd7e:5a1e:b4b3:0:aca8:e98c:5918:f3d9]:42312, version 3
[2024.07.31 07:26:10] Error from client [fd7e:5a1e:b4b3:0:aca8:e98c:5918:f3d9]:42312: Expected object
[2024.07.31 07:26:14] Serving [fd7e:5a1e:b4b3:0:aca8:e98c:5918:f3d9]:58548, version 3
[2024.07.31 07:26:43] Serving complete for [fd7e:5a1e:b4b3:0:aca8:e98c:5918:f3d9]:58548
[2024.07.31 07:26:47] Serving [fd7e:5a1e:b4b3:0:aca8:e98c:5918:f3d9]:42238, version 3
[2024.07.31 07:26:48] Error from client [fd7e:5a1e:b4b3:0:aca8:e98c:5918:f3d9]:42238: Expected object
[2024.07.31 07:26:52] Serving [fd7e:5a1e:b4b3:0:aca8:e98c:5918:f3d9]:57296, version 3
[2024.07.31 07:27:21] Serving complete for [fd7e:5a1e:b4b3:0:aca8:e98c:5918:f3d9]:57296
[2024.07.31 07:31:24] Serving [fd7e:5a1e:b4b3:0:aca8:e98c:5918:f3d9]:33158, version 3
[2024.07.31 07:31:26] Error from client [fd7e:5a1e:b4b3:0:aca8:e98c:5918:f3d9]:33158: Expected object
[2024.07.31 07:35:34] Serving [fd7e:5a1e:b4b3:0:aca8:e98c:5918:f3d9]:34212, version 3
[2024.07.31 07:35:57] Serving complete for [fd7e:5a1e:b4b3:0:aca8:e98c:5918:f3d9]:34212
[2024.07.31 07:36:11] Serving [fd7e:5a1e:b4b3:0:aca8:e98c:5918:f3d9]:56162, version 3
[2024.07.31 07:36:12] Error from client [fd7e:5a1e:b4b3:0:aca8:e98c:5918:f3d9]:56162: Expected object

------ tcpdump of final transaction -------

07:36:11.063866 IP6 rpi4.lan.35481 > fd7e:5a1e:b4b3:0:aca8:e98c:5918:f3d9.56162: Flags [S.], seq 2863303922, ack 303357595, win 64260, options [mss 1440,sackOK,TS val 2986815692 ecr 160995797,nop,wscale 7], length 0
07:36:11.068861 IP6 rpi4.lan.35481 > fd7e:5a1e:b4b3:0:aca8:e98c:5918:f3d9.56162: Flags [.], ack 25, win 502, options [nop,nop,TS val 2986815696 ecr 160995954], length 0
07:36:11.068962 IP6 rpi4.lan.35481 > fd7e:5a1e:b4b3:0:aca8:e98c:5918:f3d9.56162: Flags [P.], seq 1:25, ack 25, win 502, options [nop,nop,TS val 2986815697 ecr 160995954], length 24
07:36:11.071245 IP6 rpi4.lan.35481 > fd7e:5a1e:b4b3:0:aca8:e98c:5918:f3d9.56162: Flags [P.], seq 25:46, ack 37, win 502, options [nop,nop,TS val 2986815699 ecr 160995956], length 21
07:36:11.073930 IP6 rpi4.lan.35481 > fd7e:5a1e:b4b3:0:aca8:e98c:5918:f3d9.56162: Flags [P.], seq 46:66, ack 49, win 502, options [nop,nop,TS val 2986815702 ecr 160995958], length 20
07:36:11.074049 IP6 rpi4.lan.35481 > fd7e:5a1e:b4b3:0:aca8:e98c:5918:f3d9.57781: UDP, length 16
07:36:11.084482 IP6 rpi4.lan.35481 > fd7e:5a1e:b4b3:0:aca8:e98c:5918:f3d9.57781: UDP, length 16
07:36:11.093742 IP6 rpi4.lan.35481 > fd7e:5a1e:b4b3:0:aca8:e98c:5918:f3d9.56162: Flags [P.], seq 66:118, ack 49, win 502, options [nop,nop,TS val 2986815721 ecr 160995958], length 52
07:36:11.101691 IP6 rpi4.lan.35481 > fd7e:5a1e:b4b3:0:aca8:e98c:5918:f3d9.57781: UDP, length 16
07:36:11.104330 IP6 rpi4.lan.35481 > fd7e:5a1e:b4b3:0:aca8:e98c:5918:f3d9.57781: UDP, length 16
07:36:11.113614 IP6 rpi4.lan.35481 > fd7e:5a1e:b4b3:0:aca8:e98c:5918:f3d9.56162: Flags [P.], seq 118:170, ack 49, win 502, options [nop,nop,TS val 2986815741 ecr 160995984], length 52
07:36:11.114306 IP6 rpi4.lan.35481 > fd7e:5a1e:b4b3:0:aca8:e98c:5918:f3d9.57781: UDP, length 16
07:36:11.124287 IP6 rpi4.lan.35481 > fd7e:5a1e:b4b3:0:aca8:e98c:5918:f3d9.57781: UDP, length 16
07:36:11.133553 IP6 rpi4.lan.35481 > fd7e:5a1e:b4b3:0:aca8:e98c:5918:f3d9.56162: Flags [P.], seq 170:222, ack 49, win 502, options [nop,nop,TS val 2986815761 ecr 160995984], length 52
07:36:11.134466 IP6 rpi4.lan.35481 > fd7e:5a1e:b4b3:0:aca8:e98c:5918:f3d9.57781: UDP, length 16
07:36:11.144254 IP6 rpi4.lan.35481 > fd7e:5a1e:b4b3:0:aca8:e98c:5918:f3d9.57781: UDP, length 16
07:36:11.154285 IP6 rpi4.lan.35481 > fd7e:5a1e:b4b3:0:aca8:e98c:5918:f3d9.56162: Flags [P.], seq 222:274, ack 49, win 502, options [nop,nop,TS val 2986815782 ecr 160996020], length 52
07:36:11.154380 IP6 rpi4.lan.35481 > fd7e:5a1e:b4b3:0:aca8:e98c:5918:f3d9.57781: UDP, length 16
07:36:11.163923 IP6 rpi4.lan.35481 > fd7e:5a1e:b4b3:0:aca8:e98c:5918:f3d9.57781: UDP, length 16
07:36:11.174072 IP6 rpi4.lan.35481 > fd7e:5a1e:b4b3:0:aca8:e98c:5918:f3d9.56162: Flags [P.], seq 274:326, ack 49, win 502, options [nop,nop,TS val 2986815802 ecr 160996020], length 52
07:36:11.174138 IP6 rpi4.lan.35481 > fd7e:5a1e:b4b3:0:aca8:e98c:5918:f3d9.57781: UDP, length 16
07:36:11.183594 IP6 rpi4.lan.35481 > fd7e:5a1e:b4b3:0:aca8:e98c:5918:f3d9.57781: UDP, length 16
07:36:11.193890 IP6 rpi4.lan.35481 > fd7e:5a1e:b4b3:0:aca8:e98c:5918:f3d9.56162: Flags [P.], seq 326:378, ack 49, win 502, options [nop,nop,TS val 2986815822 ecr 160996061], length 52
07:36:11.201825 IP6 rpi4.lan.35481 > fd7e:5a1e:b4b3:0:aca8:e98c:5918:f3d9.57781: UDP, length 16
07:36:11.203670 IP6 rpi4.lan.35481 > fd7e:5a1e:b4b3:0:aca8:e98c:5918:f3d9.57781: UDP, length 16
07:36:11.213947 IP6 rpi4.lan.35481 > fd7e:5a1e:b4b3:0:aca8:e98c:5918:f3d9.56162: Flags [P.], seq 378:430, ack 49, win 502, options [nop,nop,TS val 2986815842 ecr 160996061], length 52
07:36:11.214111 IP6 rpi4.lan.35481 > fd7e:5a1e:b4b3:0:aca8:e98c:5918:f3d9.57781: UDP, length 16
07:36:11.224529 IP6 rpi4.lan.35481 > fd7e:5a1e:b4b3:0:aca8:e98c:5918:f3d9.57781: UDP, length 16
07:36:11.233767 IP6 rpi4.lan.35481 > fd7e:5a1e:b4b3:0:aca8:e98c:5918:f3d9.56162: Flags [P.], seq 430:482, ack 49, win 502, options [nop,nop,TS val 2986815861 ecr 160996101], length 52
07:36:11.233908 IP6 rpi4.lan.35481 > fd7e:5a1e:b4b3:0:aca8:e98c:5918:f3d9.57781: UDP, length 16
07:36:11.244350 IP6 rpi4.lan.35481 > fd7e:5a1e:b4b3:0:aca8:e98c:5918:f3d9.57781: UDP, length 16
07:36:11.253582 IP6 rpi4.lan.35481 > fd7e:5a1e:b4b3:0:aca8:e98c:5918:f3d9.56162: Flags [P.], seq 482:534, ack 49, win 502, options [nop,nop,TS val 2986815881 ecr 160996101], length 52
07:36:11.254482 IP6 rpi4.lan.35481 > fd7e:5a1e:b4b3:0:aca8:e98c:5918:f3d9.57781: UDP, length 16
07:36:11.264360 IP6 rpi4.lan.35481 > fd7e:5a1e:b4b3:0:aca8:e98c:5918:f3d9.57781: UDP, length 16
07:36:11.273734 IP6 rpi4.lan.35481 > fd7e:5a1e:b4b3:0:aca8:e98c:5918:f3d9.56162: Flags [P.], seq 534:586, ack 49, win 502, options [nop,nop,TS val 2986815901 ecr 160996140], length 52
07:36:11.274347 IP6 rpi4.lan.35481 > fd7e:5a1e:b4b3:0:aca8:e98c:5918:f3d9.57781: UDP, length 16
07:36:11.284364 IP6 rpi4.lan.35481 > fd7e:5a1e:b4b3:0:aca8:e98c:5918:f3d9.57781: UDP, length 16
07:36:11.293621 IP6 rpi4.lan.35481 > fd7e:5a1e:b4b3:0:aca8:e98c:5918:f3d9.56162: Flags [P.], seq 586:638, ack 49, win 502, options [nop,nop,TS val 2986815921 ecr 160996140], length 52
07:36:11.294568 IP6 rpi4.lan.35481 > fd7e:5a1e:b4b3:0:aca8:e98c:5918:f3d9.57781: UDP, length 16
07:36:11.305229 IP6 rpi4.lan.35481 > fd7e:5a1e:b4b3:0:aca8:e98c:5918:f3d9.57781: UDP, length 16
07:36:11.314537 IP6 rpi4.lan.35481 > fd7e:5a1e:b4b3:0:aca8:e98c:5918:f3d9.56162: Flags [P.], seq 638:690, ack 49, win 502, options [nop,nop,TS val 2986815942 ecr 160996189], length 52
07:36:11.317124 IP6 rpi4.lan.35481 > fd7e:5a1e:b4b3:0:aca8:e98c:5918:f3d9.57781: UDP, length 16
07:36:11.324734 IP6 rpi4.lan.35481 > fd7e:5a1e:b4b3:0:aca8:e98c:5918:f3d9.57781: UDP, length 16
07:36:11.334087 IP6 rpi4.lan.35481 > fd7e:5a1e:b4b3:0:aca8:e98c:5918:f3d9.56162: Flags [P.], seq 690:742, ack 49, win 502, options [nop,nop,TS val 2986815962 ecr 160996189], length 52
07:36:11.334262 IP6 rpi4.lan.35481 > fd7e:5a1e:b4b3:0:aca8:e98c:5918:f3d9.57781: UDP, length 16
07:36:11.343631 IP6 rpi4.lan.35481 > fd7e:5a1e:b4b3:0:aca8:e98c:5918:f3d9.57781: UDP, length 16
07:36:11.353748 IP6 rpi4.lan.35481 > fd7e:5a1e:b4b3:0:aca8:e98c:5918:f3d9.56162: Flags [P.], seq 742:794, ack 49, win 502, options [nop,nop,TS val 2986815981 ecr 160996221], length 52
07:36:11.353843 IP6 rpi4.lan.35481 > fd7e:5a1e:b4b3:0:aca8:e98c:5918:f3d9.57781: UDP, length 16
07:36:11.364429 IP6 rpi4.lan.35481 > fd7e:5a1e:b4b3:0:aca8:e98c:5918:f3d9.57781: UDP, length 16
07:36:11.373699 IP6 rpi4.lan.35481 > fd7e:5a1e:b4b3:0:aca8:e98c:5918:f3d9.56162: Flags [P.], seq 794:846, ack 49, win 502, options [nop,nop,TS val 2986816001 ecr 160996221], length 52
07:36:11.374578 IP6 rpi4.lan.35481 > fd7e:5a1e:b4b3:0:aca8:e98c:5918:f3d9.57781: UDP, length 16
07:36:11.384442 IP6 rpi4.lan.35481 > fd7e:5a1e:b4b3:0:aca8:e98c:5918:f3d9.57781: UDP, length 16
07:36:11.393680 IP6 rpi4.lan.35481 > fd7e:5a1e:b4b3:0:aca8:e98c:5918:f3d9.56162: Flags [P.], seq 846:898, ack 49, win 502, options [nop,nop,TS val 2986816021 ecr 160996261], length 52
07:36:11.394437 IP6 rpi4.lan.35481 > fd7e:5a1e:b4b3:0:aca8:e98c:5918:f3d9.57781: UDP, length 16
07:36:11.404749 IP6 rpi4.lan.35481 > fd7e:5a1e:b4b3:0:aca8:e98c:5918:f3d9.57781: UDP, length 16
07:36:11.414036 IP6 rpi4.lan.35481 > fd7e:5a1e:b4b3:0:aca8:e98c:5918:f3d9.56162: Flags [P.], seq 898:950, ack 49, win 502, options [nop,nop,TS val 2986816042 ecr 160996261], length 52
07:36:11.414455 IP6 rpi4.lan.35481 > fd7e:5a1e:b4b3:0:aca8:e98c:5918:f3d9.57781: UDP, length 16
07:36:11.423530 IP6 rpi4.lan.35481 > fd7e:5a1e:b4b3:0:aca8:e98c:5918:f3d9.57781: UDP, length 16
07:36:11.433756 IP6 rpi4.lan.35481 > fd7e:5a1e:b4b3:0:aca8:e98c:5918:f3d9.56162: Flags [P.], seq 950:1002, ack 49, win 502, options [nop,nop,TS val 2986816061 ecr 160996301], length 52
07:36:11.433915 IP6 rpi4.lan.35481 > fd7e:5a1e:b4b3:0:aca8:e98c:5918:f3d9.57781: UDP, length 16
07:36:11.444360 IP6 rpi4.lan.35481 > fd7e:5a1e:b4b3:0:aca8:e98c:5918:f3d9.57781: UDP, length 16
07:36:11.453599 IP6 rpi4.lan.35481 > fd7e:5a1e:b4b3:0:aca8:e98c:5918:f3d9.56162: Flags [P.], seq 1002:1054, ack 49, win 502, options [nop,nop,TS val 2986816081 ecr 160996301], length 52
07:36:11.454531 IP6 rpi4.lan.35481 > fd7e:5a1e:b4b3:0:aca8:e98c:5918:f3d9.57781: UDP, length 16
07:36:11.464244 IP6 rpi4.lan.35481 > fd7e:5a1e:b4b3:0:aca8:e98c:5918:f3d9.57781: UDP, length 16
07:36:11.474315 IP6 rpi4.lan.35481 > fd7e:5a1e:b4b3:0:aca8:e98c:5918:f3d9.56162: Flags [P.], seq 1054:1106, ack 49, win 502, options [nop,nop,TS val 2986816102 ecr 160996340], length 52
07:36:11.474409 IP6 rpi4.lan.35481 > fd7e:5a1e:b4b3:0:aca8:e98c:5918:f3d9.57781: UDP, length 16
07:36:11.483854 IP6 rpi4.lan.35481 > fd7e:5a1e:b4b3:0:aca8:e98c:5918:f3d9.57781: UDP, length 16
07:36:11.494121 IP6 rpi4.lan.35481 > fd7e:5a1e:b4b3:0:aca8:e98c:5918:f3d9.56162: Flags [P.], seq 1106:1158, ack 49, win 502, options [nop,nop,TS val 2986816122 ecr 160996340], length 52
07:36:11.494219 IP6 rpi4.lan.35481 > fd7e:5a1e:b4b3:0:aca8:e98c:5918:f3d9.57781: UDP, length 16
07:36:11.510361 IP6 rpi4.lan.35481 > fd7e:5a1e:b4b3:0:aca8:e98c:5918:f3d9.57781: UDP, length 16
07:36:11.513655 IP6 rpi4.lan.35481 > fd7e:5a1e:b4b3:0:aca8:e98c:5918:f3d9.56162: Flags [P.], seq 1158:1210, ack 49, win 502, options [nop,nop,TS val 2986816141 ecr 160996381], length 52
07:36:11.513844 IP6 rpi4.lan.35481 > fd7e:5a1e:b4b3:0:aca8:e98c:5918:f3d9.57781: UDP, length 16
07:36:11.524129 IP6 rpi4.lan.35481 > fd7e:5a1e:b4b3:0:aca8:e98c:5918:f3d9.57781: UDP, length 16
07:36:11.534339 IP6 rpi4.lan.35481 > fd7e:5a1e:b4b3:0:aca8:e98c:5918:f3d9.56162: Flags [P.], seq 1210:1262, ack 49, win 502, options [nop,nop,TS val 2986816162 ecr 160996381], length 52
07:36:11.534420 IP6 rpi4.lan.35481 > fd7e:5a1e:b4b3:0:aca8:e98c:5918:f3d9.57781: UDP, length 16
07:36:11.543856 IP6 rpi4.lan.35481 > fd7e:5a1e:b4b3:0:aca8:e98c:5918:f3d9.57781: UDP, length 16
07:36:11.554074 IP6 rpi4.lan.35481 > fd7e:5a1e:b4b3:0:aca8:e98c:5918:f3d9.56162: Flags [P.], seq 1262:1314, ack 49, win 502, options [nop,nop,TS val 2986816182 ecr 160996421], length 52
07:36:11.554203 IP6 rpi4.lan.35481 > fd7e:5a1e:b4b3:0:aca8:e98c:5918:f3d9.57781: UDP, length 16
07:36:11.563781 IP6 rpi4.lan.35481 > fd7e:5a1e:b4b3:0:aca8:e98c:5918:f3d9.57781: UDP, length 16
07:36:11.574078 IP6 rpi4.lan.35481 > fd7e:5a1e:b4b3:0:aca8:e98c:5918:f3d9.56162: Flags [P.], seq 1314:1366, ack 49, win 502, options [nop,nop,TS val 2986816202 ecr 160996421], length 52
07:36:11.594448 IP6 rpi4.lan.35481 > fd7e:5a1e:b4b3:0:aca8:e98c:5918:f3d9.56162: Flags [P.], seq 1366:1386, ack 49, win 502, options [nop,nop,TS val 2986816222 ecr 160996461], length 20
07:36:11.613744 IP6 rpi4.lan.35481 > fd7e:5a1e:b4b3:0:aca8:e98c:5918:f3d9.56162: Flags [P.], seq 1386:1406, ack 49, win 502, options [nop,nop,TS val 2986816241 ecr 160996461], length 20
07:36:11.634053 IP6 rpi4.lan.35481 > fd7e:5a1e:b4b3:0:aca8:e98c:5918:f3d9.56162: Flags [P.], seq 1406:1426, ack 49, win 502, options [nop,nop,TS val 2986816262 ecr 160996501], length 20
07:36:11.654403 IP6 rpi4.lan.35481 > fd7e:5a1e:b4b3:0:aca8:e98c:5918:f3d9.56162: Flags [P.], seq 1426:1446, ack 49, win 502, options [nop,nop,TS val 2986816282 ecr 160996501], length 20
07:36:11.673661 IP6 rpi4.lan.35481 > fd7e:5a1e:b4b3:0:aca8:e98c:5918:f3d9.56162: Flags [P.], seq 1446:1466, ack 49, win 502, options [nop,nop,TS val 2986816301 ecr 160996541], length 20
07:36:11.693918 IP6 rpi4.lan.35481 > fd7e:5a1e:b4b3:0:aca8:e98c:5918:f3d9.56162: Flags [P.], seq 1466:1486, ack 49, win 502, options [nop,nop,TS val 2986816322 ecr 160996541], length 20
07:36:11.714260 IP6 rpi4.lan.35481 > fd7e:5a1e:b4b3:0:aca8:e98c:5918:f3d9.56162: Flags [P.], seq 1486:1506, ack 49, win 502, options [nop,nop,TS val 2986816342 ecr 160996586], length 20
07:36:11.733638 IP6 rpi4.lan.35481 > fd7e:5a1e:b4b3:0:aca8:e98c:5918:f3d9.56162: Flags [P.], seq 1506:1526, ack 49, win 502, options [nop,nop,TS val 2986816361 ecr 160996586], length 20
07:36:11.753934 IP6 rpi4.lan.35481 > fd7e:5a1e:b4b3:0:aca8:e98c:5918:f3d9.56162: Flags [P.], seq 1526:1546, ack 49, win 502, options [nop,nop,TS val 2986816382 ecr 160996620], length 20
07:36:11.774227 IP6 rpi4.lan.35481 > fd7e:5a1e:b4b3:0:aca8:e98c:5918:f3d9.56162: Flags [P.], seq 1546:1566, ack 49, win 502, options [nop,nop,TS val 2986816402 ecr 160996620], length 20
07:36:11.793647 IP6 rpi4.lan.35481 > fd7e:5a1e:b4b3:0:aca8:e98c:5918:f3d9.56162: Flags [P.], seq 1566:1586, ack 49, win 502, options [nop,nop,TS val 2986816421 ecr 160996661], length 20
07:36:11.814020 IP6 rpi4.lan.35481 > fd7e:5a1e:b4b3:0:aca8:e98c:5918:f3d9.56162: Flags [P.], seq 1586:1606, ack 49, win 502, options [nop,nop,TS val 2986816442 ecr 160996661], length 20
07:36:11.834290 IP6 rpi4.lan.35481 > fd7e:5a1e:b4b3:0:aca8:e98c:5918:f3d9.56162: Flags [P.], seq 1606:1626, ack 49, win 502, options [nop,nop,TS val 2986816462 ecr 160996701], length 20
07:36:11.853745 IP6 rpi4.lan.35481 > fd7e:5a1e:b4b3:0:aca8:e98c:5918:f3d9.56162: Flags [P.], seq 1626:1646, ack 49, win 502, options [nop,nop,TS val 2986816481 ecr 160996701], length 20
07:36:11.874006 IP6 rpi4.lan.35481 > fd7e:5a1e:b4b3:0:aca8:e98c:5918:f3d9.56162: Flags [P.], seq 1646:1666, ack 49, win 502, options [nop,nop,TS val 2986816502 ecr 160996741], length 20
07:36:11.894266 IP6 rpi4.lan.35481 > fd7e:5a1e:b4b3:0:aca8:e98c:5918:f3d9.56162: Flags [P.], seq 1666:1686, ack 49, win 502, options [nop,nop,TS val 2986816522 ecr 160996741], length 20
07:36:11.913643 IP6 rpi4.lan.35481 > fd7e:5a1e:b4b3:0:aca8:e98c:5918:f3d9.56162: Flags [P.], seq 1686:1706, ack 49, win 502, options [nop,nop,TS val 2986816541 ecr 160996781], length 20
07:36:11.933922 IP6 rpi4.lan.35481 > fd7e:5a1e:b4b3:0:aca8:e98c:5918:f3d9.56162: Flags [P.], seq 1706:1726, ack 49, win 502, options [nop,nop,TS val 2986816562 ecr 160996781], length 20
07:36:11.954167 IP6 rpi4.lan.35481 > fd7e:5a1e:b4b3:0:aca8:e98c:5918:f3d9.56162: Flags [P.], seq 1726:1746, ack 49, win 502, options [nop,nop,TS val 2986816582 ecr 160996821], length 20
07:36:11.973526 IP6 rpi4.lan.35481 > fd7e:5a1e:b4b3:0:aca8:e98c:5918:f3d9.56162: Flags [P.], seq 1746:1766, ack 49, win 502, options [nop,nop,TS val 2986816601 ecr 160996821], length 20
07:36:11.993811 IP6 rpi4.lan.35481 > fd7e:5a1e:b4b3:0:aca8:e98c:5918:f3d9.56162: Flags [P.], seq 1766:1786, ack 49, win 502, options [nop,nop,TS val 2986816621 ecr 160996860], length 20
07:36:12.014170 IP6 rpi4.lan.35481 > fd7e:5a1e:b4b3:0:aca8:e98c:5918:f3d9.56162: Flags [P.], seq 1786:1806, ack 49, win 502, options [nop,nop,TS val 2986816642 ecr 160996860], length 20
07:36:12.034508 IP6 rpi4.lan.35481 > fd7e:5a1e:b4b3:0:aca8:e98c:5918:f3d9.56162: Flags [P.], seq 1806:1826, ack 49, win 502, options [nop,nop,TS val 2986816662 ecr 160996912], length 20
07:36:12.053914 IP6 rpi4.lan.35481 > fd7e:5a1e:b4b3:0:aca8:e98c:5918:f3d9.56162: Flags [P.], seq 1826:1846, ack 49, win 502, options [nop,nop,TS val 2986816682 ecr 160996912], length 20
07:36:12.074201 IP6 rpi4.lan.35481 > fd7e:5a1e:b4b3:0:aca8:e98c:5918:f3d9.56162: Flags [P.], seq 1846:1866, ack 49, win 502, options [nop,nop,TS val 2986816702 ecr 160996942], length 20
07:36:12.094497 IP6 rpi4.lan.35481 > fd7e:5a1e:b4b3:0:aca8:e98c:5918:f3d9.56162: Flags [P.], seq 1866:1886, ack 49, win 502, options [nop,nop,TS val 2986816722 ecr 160996942], length 20
07:36:12.113869 IP6 rpi4.lan.35481 > fd7e:5a1e:b4b3:0:aca8:e98c:5918:f3d9.56162: Flags [P.], seq 1886:1906, ack 49, win 502, options [nop,nop,TS val 2986816742 ecr 160996981], length 20
07:36:12.134180 IP6 rpi4.lan.35481 > fd7e:5a1e:b4b3:0:aca8:e98c:5918:f3d9.56162: Flags [P.], seq 1906:1926, ack 49, win 502, options [nop,nop,TS val 2986816762 ecr 160996981], length 20
07:36:12.154533 IP6 rpi4.lan.35481 > fd7e:5a1e:b4b3:0:aca8:e98c:5918:f3d9.56162: Flags [P.], seq 1926:1946, ack 49, win 502, options [nop,nop,TS val 2986816782 ecr 160997021], length 20
07:36:12.173907 IP6 rpi4.lan.35481 > fd7e:5a1e:b4b3:0:aca8:e98c:5918:f3d9.56162: Flags [P.], seq 1946:1966, ack 49, win 502, options [nop,nop,TS val 2986816802 ecr 160997021], length 20
07:36:12.194172 IP6 rpi4.lan.35481 > fd7e:5a1e:b4b3:0:aca8:e98c:5918:f3d9.56162: Flags [P.], seq 1966:1986, ack 49, win 502, options [nop,nop,TS val 2986816822 ecr 160997061], length 20
07:36:12.214454 IP6 rpi4.lan.35481 > fd7e:5a1e:b4b3:0:aca8:e98c:5918:f3d9.56162: Flags [P.], seq 1986:2006, ack 49, win 502, options [nop,nop,TS val 2986816842 ecr 160997061], length 20
07:36:12.233827 IP6 rpi4.lan.35481 > fd7e:5a1e:b4b3:0:aca8:e98c:5918:f3d9.56162: Flags [P.], seq 2006:2026, ack 49, win 502, options [nop,nop,TS val 2986816861 ecr 160997112], length 20
07:36:12.254095 IP6 rpi4.lan.35481 > fd7e:5a1e:b4b3:0:aca8:e98c:5918:f3d9.56162: Flags [P.], seq 2026:2046, ack 49, win 502, options [nop,nop,TS val 2986816882 ecr 160997112], length 20
07:36:12.274379 IP6 rpi4.lan.35481 > fd7e:5a1e:b4b3:0:aca8:e98c:5918:f3d9.56162: Flags [P.], seq 2046:2066, ack 49, win 502, options [nop,nop,TS val 2986816902 ecr 160997142], length 20
07:36:12.293756 IP6 rpi4.lan.35481 > fd7e:5a1e:b4b3:0:aca8:e98c:5918:f3d9.56162: Flags [P.], seq 2066:2086, ack 49, win 502, options [nop,nop,TS val 2986816921 ecr 160997142], length 20
07:36:12.314044 IP6 rpi4.lan.35481 > fd7e:5a1e:b4b3:0:aca8:e98c:5918:f3d9.56162: Flags [P.], seq 2086:2106, ack 49, win 502, options [nop,nop,TS val 2986816942 ecr 160997181], length 20
07:36:12.334308 IP6 rpi4.lan.35481 > fd7e:5a1e:b4b3:0:aca8:e98c:5918:f3d9.56162: Flags [P.], seq 2106:2126, ack 49, win 502, options [nop,nop,TS val 2986816962 ecr 160997181], length 20
07:36:12.353615 IP6 rpi4.lan.35481 > fd7e:5a1e:b4b3:0:aca8:e98c:5918:f3d9.56162: Flags [P.], seq 2126:2146, ack 49, win 502, options [nop,nop,TS val 2986816981 ecr 160997221], length 20
07:36:12.373970 IP6 rpi4.lan.35481 > fd7e:5a1e:b4b3:0:aca8:e98c:5918:f3d9.56162: Flags [P.], seq 2146:2166, ack 49, win 502, options [nop,nop,TS val 2986817002 ecr 160997221], length 20
07:36:12.394275 IP6 rpi4.lan.35481 > fd7e:5a1e:b4b3:0:aca8:e98c:5918:f3d9.56162: Flags [P.], seq 2166:2186, ack 49, win 502, options [nop,nop,TS val 2986817022 ecr 160997261], length 20
07:36:12.413546 IP6 rpi4.lan.35481 > fd7e:5a1e:b4b3:0:aca8:e98c:5918:f3d9.56162: Flags [P.], seq 2186:2206, ack 49, win 502, options [nop,nop,TS val 2986817041 ecr 160997261], length 20
07:36:12.433934 IP6 rpi4.lan.35481 > fd7e:5a1e:b4b3:0:aca8:e98c:5918:f3d9.56162: Flags [P.], seq 2206:2226, ack 49, win 502, options [nop,nop,TS val 2986817062 ecr 160997300], length 20
07:36:12.454221 IP6 rpi4.lan.35481 > fd7e:5a1e:b4b3:0:aca8:e98c:5918:f3d9.56162: Flags [P.], seq 2226:2246, ack 49, win 502, options [nop,nop,TS val 2986817082 ecr 160997300], length 20
07:36:12.474519 IP6 rpi4.lan.35481 > fd7e:5a1e:b4b3:0:aca8:e98c:5918:f3d9.56162: Flags [P.], seq 2246:2266, ack 49, win 502, options [nop,nop,TS val 2986817102 ecr 160997341], length 20
07:36:12.493922 IP6 rpi4.lan.35481 > fd7e:5a1e:b4b3:0:aca8:e98c:5918:f3d9.56162: Flags [P.], seq 2266:2286, ack 49, win 502, options [nop,nop,TS val 2986817122 ecr 160997341], length 20
07:36:12.514204 IP6 rpi4.lan.35481 > fd7e:5a1e:b4b3:0:aca8:e98c:5918:f3d9.56162: Flags [P.], seq 2286:2306, ack 49, win 502, options [nop,nop,TS val 2986817142 ecr 160997381], length 20
07:36:12.534493 IP6 rpi4.lan.35481 > fd7e:5a1e:b4b3:0:aca8:e98c:5918:f3d9.56162: Flags [P.], seq 2306:2326, ack 49, win 502, options [nop,nop,TS val 2986817162 ecr 160997381], length 20
07:36:12.553855 IP6 rpi4.lan.35481 > fd7e:5a1e:b4b3:0:aca8:e98c:5918:f3d9.56162: Flags [P.], seq 2326:2346, ack 49, win 502, options [nop,nop,TS val 2986817182 ecr 160997421], length 20
07:36:12.593942 IP6 rpi4.lan.35481 > fd7e:5a1e:b4b3:0:aca8:e98c:5918:f3d9.56162: Flags [P.], seq 2346:2366, ack 61, win 502, options [nop,nop,TS val 2986817222 ecr 160997459], length 20
07:36:12.593996 IP6 rpi4.lan.35481 > fd7e:5a1e:b4b3:0:aca8:e98c:5918:f3d9.56162: Flags [P.], seq 2366:2386, ack 61, win 502, options [nop,nop,TS val 2986817222 ecr 160997459], length 20
07:36:12.594025 IP6 rpi4.lan.35481 > fd7e:5a1e:b4b3:0:aca8:e98c:5918:f3d9.56162: Flags [P.], seq 2386:2399, ack 61, win 502, options [nop,nop,TS val 2986817222 ecr 160997459], length 13
07:36:12.599110 IP6 rpi4.lan.35481 > fd7e:5a1e:b4b3:0:aca8:e98c:5918:f3d9.56162: Flags [F.], seq 2399, ack 62, win 502, options [nop,nop,TS val 2986817227 ecr 160997484], length 0
```

**Comment by richb-hanover** [comment]
@Zoxc NB - the pattern of success/crash persists with IPv6; it always works with IPv4...

**Comment by richb-hanover** [comment]
Update: I wondered whether running a new test right after a successful test might somehow screw up the results. Nope - the alternating pattern continues.

I ran a successful test, waited two minutes, then ran again and it failed the same way. Waiting another 2 minutes and rerunning gave a successful test.

**Comment by richb-hanover** [comment]
Lots of other noise, but here's a failing session. I don't know why the server would be sending from both `::d35` and `::98a`... I haven't done anything fancy with IPv6 addressing on these hosts.

Full disclosure: I seem to have managed to assign both 192.168.253.225 & 192.168.253.226 to this RPi... I need to investigate that.

```
=======  sudo tcpdump -i eth0 -n port not 22 ========

09:06:22.579548 78:8c:b5:ce:2f:d9 > ff:ff:ff:ff:ff:ff, RRCP-0x25 query
09:06:22.801446 IP 0.0.0.0 > 224.0.0.1: igmp query v2
09:06:23.582992 78:8c:b5:ce:2f:d9 > ff:ff:ff:ff:ff:ff, RRCP-0x25 query
09:06:23.852613 IP 192.168.253.102.38257 > 255.255.255.255.7423: UDP, length 173
09:06:24.401209 IP 192.168.253.177 > 239.255.255.250: igmp v2 report 239.255.255.250
09:06:24.580920 78:8c:b5:ce:2f:d9 > ff:ff:ff:ff:ff:ff, RRCP-0x25 query
09:06:24.774091 ARP, Request who-has 192.168.253.5 tell 192.168.253.6, length 46
09:06:25.422922 IP 192.168.253.238 > 224.0.0.251: igmp v2 report 224.0.0.251
09:06:25.582022 78:8c:b5:ce:2f:d9 > ff:ff:ff:ff:ff:ff, RRCP-0x25 query
09:06:25.863451 IP 192.168.253.118.56839 > 192.168.253.255.21027: UDP, length 765
09:06:25.903366 IP 192.168.253.177.17500 > 255.255.255.255.17500: UDP, length 184
09:06:25.909093 IP 192.168.253.177.17500 > 255.255.255.255.17500: UDP, length 184
09:06:25.909230 IP 192.168.253.177.17500 > 255.255.255.255.17500: UDP, length 184
09:06:25.909269 IP 192.168.253.177.17500 > 192.168.253.255.17500: UDP, length 184
09:06:25.909347 IP 192.168.253.177.17500 > 255.255.255.255.17500: UDP, length 184
09:06:25.909347 IP 192.168.253.177.17500 > 255.255.255.255.17500: UDP, length 184
09:06:25.999821 IP 192.168.253.120.5353 > 224.0.0.251.5353: 0 [5a] [4q] PTR (QM)? _companion-link._tcp.local. PTR (QM)? _homekit._tcp.local. PTR (QM)? _rdlink._tcp.local. PTR (QM)? _sleep-proxy._udp.local. (258)
09:06:25.999938 IP6 fe80::1434:cead:f56e:e4fb.5353 > ff02::fb.5353: 0 [5a] [4q] PTR (QM)? _companion-link._tcp.local. PTR (QM)? _homekit._tcp.local. PTR (QM)? _rdlink._tcp.local. PTR (QM)? _sleep-proxy._udp.local. (258)
09:06:26.309810 IP 192.168.253.120.5353 > 224.0.0.251.5353: 0*- [0q] 2/0/0 PTR 5c:3e:1b:d5:d3:43@fe80::5e3e:1bff:fed5:d343-supportsRP-19._apple-mobdev2._tcp.local., PTR 5c:3e:1b:d5:d3:43@fe80::5e3e:1bff:fed5:d343-supportsRP-19._apple-mobdev2._tcp.local. (137)
09:06:26.309910 IP6 fe80::1434:cead:f56e:e4fb.5353 > ff02::fb.5353: 0*- [0q] 2/0/0 PTR 5c:3e:1b:d5:d3:43@fe80::5e3e:1bff:fed5:d343-supportsRP-19._apple-mobdev2._tcp.local., PTR 5c:3e:1b:d5:d3:43@fe80::5e3e:1bff:fed5:d343-supportsRP-19._apple-mobdev2._tcp.local. (137)
09:06:26.425175 IP 192.168.253.177 > 224.0.0.252: igmp v2 report 224.0.0.252
09:06:26.582414 78:8c:b5:ce:2f:d9 > ff:ff:ff:ff:ff:ff, RRCP-0x25 query
09:06:26.884489 IP 50.203.141.214.22067 > 192.168.253.225.38146: Flags [.], ack 35, win 502, options [nop,nop,TS val 2498895585 ecr 3226835975], length 0
09:06:26.884773 IP 192.168.253.225.38146 > 50.203.141.214.22067: Flags [.], ack 35, win 501, options [nop,nop,TS val 3226851164 ecr 2498880432], length 0
09:06:26.912421 IP 192.168.253.102.38257 > 255.255.255.255.7423: UDP, length 173
09:06:26.952981 IP 192.168.253.225.38146 > 50.203.141.214.22067: Flags [.], ack 35, win 501, options [nop,nop,TS val 3226851233 ecr 2498880432], length 0
09:06:26.989262 IP 50.203.141.214.22067 > 192.168.253.225.38146: Flags [.], ack 35, win 502, options [nop,nop,TS val 2498895689 ecr 3226851164], length 0
09:06:27.586143 78:8c:b5:ce:2f:d9 > ff:ff:ff:ff:ff:ff, RRCP-0x25 query
09:06:27.826889 ARP, Request who-has 192.168.253.5 tell 192.168.253.6, length 46
09:06:28.583854 78:8c:b5:ce:2f:d9 > ff:ff:ff:ff:ff:ff, RRCP-0x25 query
09:06:29.565057 IP6 fd7e:5a1e:b4b3::d35.35481 > fd7e:5a1e:b4b3:0:aca8:e98c:5918:f3d9.50532: Flags [S.], seq 1081263356, ack 1977771375, win 64260, options [mss 1440,sackOK,TS val 2992234193 ecr 166414452,nop,wscale 7], length 0
09:06:29.571134 IP6 fd7e:5a1e:b4b3::d35.35481 > fd7e:5a1e:b4b3:0:aca8:e98c:5918:f3d9.50532: Flags [.], ack 25, win 502, options [nop,nop,TS val 2992234199 ecr 166414456], length 0
09:06:29.571533 IP6 fd7e:5a1e:b4b3::d35.35481 > fd7e:5a1e:b4b3:0:aca8:e98c:5918:f3d9.50532: Flags [P.], seq 1:25, ack 25, win 502, options [nop,nop,TS val 2992234199 ecr 166414456], length 24
09:06:29.577614 IP6 fd7e:5a1e:b4b3::d35.35481 > fd7e:5a1e:b4b3:0:aca8:e98c:5918:f3d9.50532: Flags [P.], seq 25:46, ack 37, win 502, options [nop,nop,TS val 2992234205 ecr 166414462], length 21
09:06:29.583588 IP6 fd7e:5a1e:b4b3::98a.35481 > fd7e:5a1e:b4b3:0:aca8:e98c:5918:f3d9.32919: UDP, length 16
09:06:29.584500 IP6 fd7e:5a1e:b4b3:0:aca8:e98c:5918:f3d9 > fd7e:5a1e:b4b3::98a: ICMP6, destination unreachable, unreachable port, fd7e:5a1e:b4b3:0:aca8:e98c:5918:f3d9 udp port 32919, length 72
09:06:29.584846 IP6 fd7e:5a1e:b4b3::d35.35481 > fd7e:5a1e:b4b3:0:aca8:e98c:5918:f3d9.50532: Flags [P.], seq 46:82, ack 49, win 502, options [nop,nop,TS val 2992234212 ecr 166414468], length 36
09:06:29.585078 78:8c:b5:ce:2f:d9 > ff:ff:ff:ff:ff:ff, RRCP-0x25 query
09:06:29.601251 IP6 fd7e:5a1e:b4b3::98a.35481 > fd7e:5a1e:b4b3:0:aca8:e98c:5918:f3d9.32919: UDP, length 16
09:06:29.601361 IP6 fd7e:5a1e:b4b3::98a.35481 > fd7e:5a1e:b4b3:0:aca8:e98c:5918:f3d9.32919: UDP, length 16
09:06:29.602474 IP6 fd7e:5a1e:b4b3:0:aca8:e98c:5918:f3d9 > fd7e:5a1e:b4b3::98a: ICMP6, destination unreachable, unreachable port, fd7e:5a1e:b4b3:0:aca8:e98c:5918:f3d9 udp port 32919, length 72
09:06:29.602509 IP6 fd7e:5a1e:b4b3:0:aca8:e98c:5918:f3d9 > fd7e:5a1e:b4b3::98a: ICMP6, destination unreachable, unreachable port, fd7e:5a1e:b4b3:0:aca8:e98c:5918:f3d9 udp port 32919, length 72
09:06:29.604619 IP6 fd7e:5a1e:b4b3::d35.35481 > fd7e:5a1e:b4b3:0:aca8:e98c:5918:f3d9.50532: Flags [P.], seq 82:134, ack 49, win 502, options [nop,nop,TS val 2992234232 ecr 166414468], length 52
09:06:29.624649 IP6 fd7e:5a1e:b4b3::d35.35481 > fd7e:5a1e:b4b3:0:aca8:e98c:5918:f3d9.50532: Flags [P.], seq 134:154, ack 49, win 502, options [nop,nop,TS val 2992234252 ecr 166414495], length 20
09:06:29.624763 IP6 fd7e:5a1e:b4b3::98a.35481 > fd7e:5a1e:b4b3:0:aca8:e98c:5918:f3d9.32919: UDP, length 16
09:06:29.624911 IP6 fd7e:5a1e:b4b3::98a.35481 > fd7e:5a1e:b4b3:0:aca8:e98c:5918:f3d9.32919: UDP, length 16
09:06:29.626158 IP6 fd7e:5a1e:b4b3:0:aca8:e98c:5918:f3d9 > fd7e:5a1e:b4b3::98a: ICMP6, destination unreachable, unreachable port, fd7e:5a1e:b4b3:0:aca8:e98c:5918:f3d9 udp port 32919, length 72
09:06:29.626212 IP6 fd7e:5a1e:b4b3:0:aca8:e98c:5918:f3d9 > fd7e:5a1e:b4b3::98a: ICMP6, destination unreachable, unreachable port, fd7e:5a1e:b4b3:0:aca8:e98c:5918:f3d9 udp port 32919, length 72
09:06:29.630533 IP6 fd7e:5a1e:b4b3::98a.35481 > fd7e:5a1e:b4b3:0:aca8:e98c:5918:f3d9.32919: UDP, length 16
09:06:29.631293 IP6 fd7e:5a1e:b4b3:0:aca8:e98c:5918:f3d9 > fd7e:5a1e:b4b3::98a: ICMP6, destination unreachable, unreachable port, fd7e:5a1e:b4b3:0:aca8:e98c:5918:f3d9 udp port 32919, length 72
09:06:29.644940 IP6 fd7e:5a1e:b4b3::d35.35481 > fd7e:5a1e:b4b3:0:aca8:e98c:5918:f3d9.50532: Flags [P.], seq 154:222, ack 49, win 502, options [nop,nop,TS val 2992234273 ecr 166414495], length 68
09:06:29.648111 IP6 fd7e:5a1e:b4b3::98a.35481 > fd7e:5a1e:b4b3:0:aca8:e98c:5918:f3d9.32919: UDP, length 16
09:06:29.662131 IP6 fd7e:5a1e:b4b3::98a.35481 > fd7e:5a1e:b4b3:0:aca8:e98c:5918:f3d9.32919: UDP, length 16
09:06:29.665448 IP6 fd7e:5a1e:b4b3::d35.35481 > fd7e:5a1e:b4b3:0:aca8:e98c:5918:f3d9.50532: Flags [P.], seq 222:274, ack 49, win 502, options [nop,nop,TS val 2992234293 ecr 166414536], length 52
09:06:29.668360 IP6 fd7e:5a1e:b4b3::98a.35481 > fd7e:5a1e:b4b3:0:aca8:e98c:5918:f3d9.32919: UDP, length 16
09:06:29.674426 IP6 fd7e:5a1e:b4b3::98a.35481 > fd7e:5a1e:b4b3:0:aca8:e98c:5918:f3d9.32919: UDP, length 16
09:06:29.684709 IP6 fd7e:5a1e:b4b3::d35.35481 > fd7e:5a1e:b4b3:0:aca8:e98c:5918:f3d9.50532: Flags [P.], seq 274:326, ack 49, win 502, options [nop,nop,TS val 2992234312 ecr 166414536], length 52
09:06:29.685980 IP6 fd7e:5a1e:b4b3::98a.35481 > fd7e:5a1e:b4b3:0:aca8:e98c:5918:f3d9.32919: UDP, length 16
09:06:29.692253 IP6 fd7e:5a1e:b4b3::98a.35481 > fd7e:5a1e:b4b3:0:aca8:e98c:5918:f3d9.32919: UDP, length 16
09:06:29.703472 IP6 fd7e:5a1e:b4b3::98a.35481 > fd7e:5a1e:b4b3:0:aca8:e98c:5918:f3d9.32919: UDP, length 16
09:06:29.704700 IP6 fd7e:5a1e:b4b3::d35.35481 > fd7e:5a1e:b4b3:0:aca8:e98c:5918:f3d9.50532: Flags [P.], seq 326:394, ack 49, win 502, options [nop,nop,TS val 2992234332 ecr 166414575], length 68
09:06:29.715101 IP6 fd7e:5a1e:b4b3::98a.35481 > fd7e:5a1e:b4b3:0:aca8:e98c:5918:f3d9.32919: UDP, length 16
09:06:29.725382 IP6 fd7e:5a1e:b4b3::d35.35481 > fd7e:5a1e:b4b3:0:aca8:e98c:5918:f3d9.50532: Flags [P.], seq 394:430, ack 49, win 502, options [nop,nop,TS val 2992234353 ecr 166414575], length 36
09:06:29.725927 IP6 fd7e:5a1e:b4b3::98a.35481 > fd7e:5a1e:b4b3:0:aca8:e98c:5918:f3d9.32919: UDP, length 16
09:06:29.732261 IP6 fd7e:5a1e:b4b3::98a.35481 > fd7e:5a1e:b4b3:0:aca8:e98c:5918:f3d9.32919: UDP, length 16
09:06:29.745108 IP6 fd7e:5a1e:b4b3::d35.35481 > fd7e:5a1e:b4b3:0:aca8:e98c:5918:f3d9.50532: Flags [P.], seq 430:482, ack 49, win 502, options [nop,nop,TS val 2992234373 ecr 166414616], length 52
09:06:29.745219 IP6 fd7e:5a1e:b4b3::98a.35481 > fd7e:5a1e:b4b3:0:aca8:e98c:5918:f3d9.32919: UDP, length 16
09:06:29.762020 IP6 fd7e:5a1e:b4b3::98a.35481 > fd7e:5a1e:b4b3:0:aca8:e98c:5918:f3d9.32919: UDP, length 16
09:06:29.765383 IP6 fd7e:5a1e:b4b3::d35.35481 > fd7e:5a1e:b4b3:0:aca8:e98c:5918:f3d9.50532: Flags [P.], seq 482:534, ack 49, win 502, options [nop,nop,TS val 2992234393 ecr 166414616], length 52
09:06:29.770058 IP6 fd7e:5a1e:b4b3::98a.35481 > fd7e:5a1e:b4b3:0:aca8:e98c:5918:f3d9.32919: UDP, length 16
09:06:29.775710 IP6 fd7e:5a1e:b4b3::98a.35481 > fd7e:5a1e:b4b3:0:aca8:e98c:5918:f3d9.32919: UDP, length 16
09:06:29.781930 IP6 fd7e:5a1e:b4b3::98a.35481 > fd7e:5a1e:b4b3:0:aca8:e98c:5918:f3d9.32919: UDP, length 16
09:06:29.785153 IP6 fd7e:5a1e:b4b3::d35.35481 > fd7e:5a1e:b4b3:0:aca8:e98c:5918:f3d9.50532: Flags [P.], seq 534:602, ack 49, win 502, options [nop,nop,TS val 2992234413 ecr 166414657], length 68
09:06:29.800094 IP6 fd7e:5a1e:b4b3::98a.35481 > fd7e:5a1e:b4b3:0:aca8:e98c:5918:f3d9.32919: UDP, length 16
09:06:29.805312 IP6 fd7e:5a1e:b4b3::d35.35481 > fd7e:5a1e:b4b3:0:aca8:e98c:5918:f3d9.50532: Flags [P.], seq 602:638, ack 49, win 502, options [nop,nop,TS val 2992234433 ecr 166414657], length 36
09:06:29.805543 IP6 fd7e:5a1e:b4b3::98a.35481 > fd7e:5a1e:b4b3:0:aca8:e98c:5918:f3d9.32919: UDP, length 16
09:06:29.811643 IP6 fd7e:5a1e:b4b3::98a.35481 > fd7e:5a1e:b4b3:0:aca8:e98c:5918:f3d9.32919: UDP, length 16
09:06:29.822561 IP6 fd7e:5a1e:b4b3::98a.35481 > fd7e:5a1e:b4b3:0:aca8:e98c:5918:f3d9.32919: UDP, length 16
09:06:29.824778 IP6 fd7e:5a1e:b4b3::d35.35481 > fd7e:5a1e:b4b3:0:aca8:e98c:5918:f3d9.50532: Flags [P.], seq 638:706, ack 49, win 502, options [nop,nop,TS val 2992234452 ecr 166414696], length 68
09:06:29.833671 IP6 fd7e:5a1e:b4b3::98a.35481 > fd7e:5a1e:b4b3:0:aca8:e98c:5918:f3d9.32919: UDP, length 16
09:06:29.834810 IP6 fd7e:5a1e:b4b3:0:aca8:e98c:5918:f3d9 > fd7e:5a1e:b4b3::98a: ICMP6, destination unreachable, unreachable port, fd7e:5a1e:b4b3:0:aca8:e98c:5918:f3d9 udp port 32919, length 72
09:06:29.844967 IP6 fd7e:5a1e:b4b3::d35.35481 > fd7e:5a1e:b4b3:0:aca8:e98c:5918:f3d9.50532: Flags [P.], seq 706:742, ack 49, win 502, options [nop,nop,TS val 2992234473 ecr 166414696], length 36
09:06:29.845496 IP6 fd7e:5a1e:b4b3::98a.35481 > fd7e:5a1e:b4b3:0:aca8:e98c:5918:f3d9.32919: UDP, length 16
09:06:29.852705 IP6 fd7e:5a1e:b4b3::98a.35481 > fd7e:5a1e:b4b3:0:aca8:e98c:5918:f3d9.32919: UDP, length 16
09:06:29.864952 IP6 fd7e:5a1e:b4b3::d35.35481 > fd7e:5a1e:b4b3:0:aca8:e98c:5918:f3d9.50532: Flags [P.], seq 742:794, ack 49, win 502, options [nop,nop,TS val 2992234493 ecr 166414736], length 52
09:06:29.865874 IP6 fd7e:5a1e:b4b3::98a.35481 > fd7e:5a1e:b4b3:0:aca8:e98c:5918:f3d9.32919: UDP, length 16
09:06:29.871638 IP6 fd7e:5a1e:b4b3::98a.35481 > fd7e:5a1e:b4b3:0:aca8:e98c:5918:f3d9.32919: UDP, length 16
09:06:29.884989 IP6 fd7e:5a1e:b4b3::d35.35481 > fd7e:5a1e:b4b3:0:aca8:e98c:5918:f3d9.50532: Flags [P.], seq 794:846, ack 49, win 502, options [nop,nop,TS val 2992234513 ecr 166414736], length 52
09:06:29.888396 IP6 fd7e:5a1e:b4b3::98a.35481 > fd7e:5a1e:b4b3:0:aca8:e98c:5918:f3d9.32919: UDP, length 16
09:06:29.895056 IP6 fd7e:5a1e:b4b3::98a.35481 > fd7e:5a1e:b4b3:0:aca8:e98c:5918:f3d9.32919: UDP, length 16
09:06:29.901073 IP6 fd7e:5a1e:b4b3::98a.35481 > fd7e:5a1e:b4b3:0:aca8:e98c:5918:f3d9.32919: UDP, length 16
09:06:29.905320 IP6 fd7e:5a1e:b4b3::d35.35481 > fd7e:5a1e:b4b3:0:aca8:e98c:5918:f3d9.50532: Flags [P.], seq 846:914, ack 49, win 502, options [nop,nop,TS val 2992234533 ecr 166414776], length 68
09:06:29.911927 IP6 fd7e:5a1e:b4b3::98a.35481 > fd7e:5a1e:b4b3:0:aca8:e98c:5918:f3d9.32919: UDP, length 16
09:06:29.922566 IP6 fd7e:5a1e:b4b3::98a.35481 > fd7e:5a1e:b4b3:0:aca8:e98c:5918:f3d9.32919: UDP, length 16
09:06:29.924810 IP6 fd7e:5a1e:b4b3::d35.35481 > fd7e:5a1e:b4b3:0:aca8:e98c:5918:f3d9.50532: Flags [P.], seq 914:966, ack 49, win 502, options [nop,nop,TS val 2992234552 ecr 166414776], length 52
09:06:29.933875 IP6 fd7e:5a1e:b4b3::98a.35481 > fd7e:5a1e:b4b3:0:aca8:e98c:5918:f3d9.32919: UDP, length 16
09:06:29.945088 IP6 fd7e:5a1e:b4b3::d35.35481 > fd7e:5a1e:b4b3:0:aca8:e98c:5918:f3d9.50532: Flags [P.], seq 966:1002, ack 49, win 502, options [nop,nop,TS val 2992234573 ecr 166414815], length 36
09:06:29.945406 IP6 fd7e:5a1e:b4b3::98a.35481 > fd7e:5a1e:b4b3:0:aca8:e98c:5918:f3d9.32919: UDP, length 16
09:06:29.951097 IP6 fd7e:5a1e:b4b3::98a.35481 > fd7e:5a1e:b4b3:0:aca8:e98c:5918:f3d9.32919: UDP, length 16
09:06:29.964906 IP6 fd7e:5a1e:b4b3::d35.35481 > fd7e:5a1e:b4b3:0:aca8:e98c:5918:f3d9.50532: Flags [P.], seq 1002:1054, ack 49, win 502, options [nop,nop,TS val 2992234593 ecr 166414815], length 52
09:06:29.965010 IP6 fd7e:5a1e:b4b3::98a.35481 > fd7e:5a1e:b4b3:0:aca8:e98c:5918:f3d9.32919: UDP, length 16
09:06:29.972671 IP 192.168.253.102.38257 > 255.255.255.255.7423: UDP, length 173
09:06:29.977549 IP6 fd7e:5a1e:b4b3::98a.35481 > fd7e:5a1e:b4b3:0:aca8:e98c:5918:f3d9.32919: UDP, length 16
09:06:29.983887 IP6 fd7e:5a1e:b4b3::98a.35481 > fd7e:5a1e:b4b3:0:aca8:e98c:5918:f3d9.32919: UDP, length 16
09:06:29.985159 IP6 fd7e:5a1e:b4b3::d35.35481 > fd7e:5a1e:b4b3:0:aca8:e98c:5918:f3d9.50532: Flags [P.], seq 1054:1122, ack 49, win 502, options [nop,nop,TS val 2992234613 ecr 166414855], length 68
09:06:29.995205 IP6 fd7e:5a1e:b4b3::98a.35481 > fd7e:5a1e:b4b3:0:aca8:e98c:5918:f3d9.32919: UDP, length 16
09:06:30.001040 IP6 fd7e:5a1e:b4b3::98a.35481 > fd7e:5a1e:b4b3:0:aca8:e98c:5918:f3d9.32919: UDP, length 16
09:06:30.005400 IP6 fd7e:5a1e:b4b3::d35.35481 > fd7e:5a1e:b4b3:0:aca8:e98c:5918:f3d9.50532: Flags [P.], seq 1122:1174, ack 49, win 502, options [nop,nop,TS val 2992234633 ecr 166414855], length 52
09:06:30.011945 IP6 fd7e:5a1e:b4b3::98a.35481 > fd7e:5a1e:b4b3:0:aca8:e98c:5918:f3d9.32919: UDP, length 16
09:06:30.022697 IP6 fd7e:5a1e:b4b3::98a.35481 > fd7e:5a1e:b4b3:0:aca8:e98c:5918:f3d9.32919: UDP, length 16
09:06:30.024966 IP6 fd7e:5a1e:b4b3::d35.35481 > fd7e:5a1e:b4b3:0:aca8:e98c:5918:f3d9.50532: Flags [P.], seq 1174:1226, ack 49, win 502, options [nop,nop,TS val 2992234653 ecr 166414896], length 52
09:06:30.033599 IP6 fd7e:5a1e:b4b3::98a.35481 > fd7e:5a1e:b4b3:0:aca8:e98c:5918:f3d9.32919: UDP, length 16
09:06:30.044935 IP6 fd7e:5a1e:b4b3::d35.35481 > fd7e:5a1e:b4b3:0:aca8:e98c:5918:f3d9.50532: Flags [P.], seq 1226:1262, ack 49, win 502, options [nop,nop,TS val 2992234673 ecr 166414896], length 36
09:06:30.045571 IP6 fd7e:5a1e:b4b3::98a.35481 > fd7e:5a1e:b4b3:0:aca8:e98c:5918:f3d9.32919: UDP, length 16
09:06:30.051168 IP6 fd7e:5a1e:b4b3::98a.35481 > fd7e:5a1e:b4b3:0:aca8:e98c:5918:f3d9.32919: UDP, length 16
09:06:30.061865 IP6 fd7e:5a1e:b4b3::98a.35481 > fd7e:5a1e:b4b3:0:aca8:e98c:5918:f3d9.32919: UDP, length 16
09:06:30.065102 IP6 fd7e:5a1e:b4b3::d35.35481 > fd7e:5a1e:b4b3:0:aca8:e98c:5918:f3d9.50532: Flags [P.], seq 1262:1330, ack 49, win 502, options [nop,nop,TS val 2992234693 ecr 166414936], length 68
09:06:30.075212 IP6 fd7e:5a1e:b4b3::98a.35481 > fd7e:5a1e:b4b3:0:aca8:e98c:5918:f3d9.32919: UDP, length 16
09:06:30.084514 IP6 fd7e:5a1e:b4b3::d35.35481 > fd7e:5a1e:b4b3:0:aca8:e98c:5918:f3d9.50532: Flags [P.], seq 1330:1366, ack 49, win 502, options [nop,nop,TS val 2992234712 ecr 166414936], length 36
09:06:30.104878 IP6 fd7e:5a1e:b4b3::d35.35481 > fd7e:5a1e:b4b3:0:aca8:e98c:5918:f3d9.50532: Flags [P.], seq 1366:1386, ack 49, win 502, options [nop,nop,TS val 2992234733 ecr 166414975], length 20
09:06:30.125134 IP6 fd7e:5a1e:b4b3::d35.35481 > fd7e:5a1e:b4b3:0:aca8:e98c:5918:f3d9.50532: Flags [P.], seq 1386:1406, ack 49, win 502, options [nop,nop,TS val 2992234753 ecr 166414975], length 20
09:06:30.145393 IP6 fd7e:5a1e:b4b3::d35.35481 > fd7e:5a1e:b4b3:0:aca8:e98c:5918:f3d9.50532: Flags [P.], seq 1406:1426, ack 49, win 502, options [nop,nop,TS val 2992234773 ecr 166415021], length 20
09:06:30.164840 IP6 fd7e:5a1e:b4b3::d35.35481 > fd7e:5a1e:b4b3:0:aca8:e98c:5918:f3d9.50532: Flags [P.], seq 1426:1446, ack 49, win 502, options [nop,nop,TS val 2992234792 ecr 166415021], length 20
09:06:30.185123 IP6 fd7e:5a1e:b4b3::d35.35481 > fd7e:5a1e:b4b3:0:aca8:e98c:5918:f3d9.50532: Flags [P.], seq 1446:1466, ack 49, win 502, options [nop,nop,TS val 2992234813 ecr 166415056], length 20
09:06:30.205430 IP6 fd7e:5a1e:b4b3::d35.35481 > fd7e:5a1e:b4b3:0:aca8:e98c:5918:f3d9.50532: Flags [P.], seq 1466:1486, ack 49, win 502, options [nop,nop,TS val 2992234833 ecr 166415056], length 20
09:06:30.225006 IP6 fd7e:5a1e:b4b3::d35.35481 > fd7e:5a1e:b4b3:0:aca8:e98c:5918:f3d9.50532: Flags [P.], seq 1486:1506, ack 49, win 502, options [nop,nop,TS val 2992234853 ecr 166415096], length 20
09:06:30.245292 IP6 fd7e:5a1e:b4b3::d35.35481 > fd7e:5a1e:b4b3:0:aca8:e98c:5918:f3d9.50532: Flags [P.], seq 1506:1526, ack 49, win 502, options [nop,nop,TS val 2992234873 ecr 166415096], length 20
09:06:30.264530 IP6 fd7e:5a1e:b4b3::d35.35481 > fd7e:5a1e:b4b3:0:aca8:e98c:5918:f3d9.50532: Flags [P.], seq 1526:1546, ack 49, win 502, options [nop,nop,TS val 2992234892 ecr 166415136], length 20
09:06:30.285028 IP6 fd7e:5a1e:b4b3::d35.35481 > fd7e:5a1e:b4b3:0:aca8:e98c:5918:f3d9.50532: Flags [P.], seq 1546:1566, ack 49, win 502, options [nop,nop,TS val 2992234913 ecr 166415136], length 20
09:06:30.305314 IP6 fd7e:5a1e:b4b3::d35.35481 > fd7e:5a1e:b4b3:0:aca8:e98c:5918:f3d9.50532: Flags [P.], seq 1566:1586, ack 49, win 502, options [nop,nop,TS val 2992234933 ecr 166415136], length 20
09:06:30.324641 IP6 fd7e:5a1e:b4b3::d35.35481 > fd7e:5a1e:b4b3:0:aca8:e98c:5918:f3d9.50532: Flags [P.], seq 1586:1606, ack 49, win 502, options [nop,nop,TS val 2992234952 ecr 166415176], length 20
09:06:30.345050 IP6 fd7e:5a1e:b4b3::d35.35481 > fd7e:5a1e:b4b3:0:aca8:e98c:5918:f3d9.50532: Flags [P.], seq 1606:1626, ack 49, win 502, options [nop,nop,TS val 2992234973 ecr 166415215], length 20
09:06:30.365305 IP6 fd7e:5a1e:b4b3::d35.35481 > fd7e:5a1e:b4b3:0:aca8:e98c:5918:f3d9.50532: Flags [P.], seq 1626:1646, ack 49, win 502, options [nop,nop,TS val 2992234993 ecr 166415215], length 20
09:06:30.384557 IP6 fd7e:5a1e:b4b3::d35.35481 > fd7e:5a1e:b4b3:0:aca8:e98c:5918:f3d9.50532: Flags [P.], seq 1646:1666, ack 49, win 502, options [nop,nop,TS val 2992235012 ecr 166415256], length 20
09:06:30.404946 IP6 fd7e:5a1e:b4b3::d35.35481 > fd7e:5a1e:b4b3:0:aca8:e98c:5918:f3d9.50532: Flags [P.], seq 1666:1686, ack 49, win 502, options [nop,nop,TS val 2992235033 ecr 166415256], length 20
09:06:30.425209 IP6 fd7e:5a1e:b4b3::d35.35481 > fd7e:5a1e:b4b3:0:aca8:e98c:5918:f3d9.50532: Flags [P.], seq 1686:1706, ack 49, win 502, options [nop,nop,TS val 2992235053 ecr 166415296], length 20
09:06:30.445545 IP6 fd7e:5a1e:b4b3::d35.35481 > fd7e:5a1e:b4b3:0:aca8:e98c:5918:f3d9.50532: Flags [P.], seq 1706:1726, ack 49, win 502, options [nop,nop,TS val 2992235073 ecr 166415296], length 20
09:06:30.464798 IP6 fd7e:5a1e:b4b3::d35.35481 > fd7e:5a1e:b4b3:0:aca8:e98c:5918:f3d9.50532: Flags [P.], seq 1726:1746, ack 49, win 502, options [nop,nop,TS val 2992235092 ecr 166415336], length 20
09:06:30.485210 IP6 fd7e:5a1e:b4b3::d35.35481 > fd7e:5a1e:b4b3:0:aca8:e98c:5918:f3d9.50532: Flags [P.], seq 1746:1766, ack 49, win 502, options [nop,nop,TS val 2992235113 ecr 166415336], length 20
09:06:30.505487 IP6 fd7e:5a1e:b4b3::d35.35481 > fd7e:5a1e:b4b3:0:aca8:e98c:5918:f3d9.50532: Flags [P.], seq 1766:1786, ack 49, win 502, options [nop,nop,TS val 2992235133 ecr 166415376], length 20
09:06:30.524795 IP6 fd7e:5a1e:b4b3::d35.35481 > fd7e:5a1e:b4b3:0:aca8:e98c:5918:f3d9.50532: Flags [P.], seq 1786:1806, ack 49, win 502, options [nop,nop,TS val 2992235152 ecr 166415376], length 20
09:06:30.545175 IP6 fd7e:5a1e:b4b3::d35.35481 > fd7e:5a1e:b4b3:0:aca8:e98c:5918:f3d9.50532: Flags [P.], seq 1806:1826, ack 49, win 502, options [nop,nop,TS val 2992235173 ecr 166415415], length 20
09:06:30.565515 IP6 fd7e:5a1e:b4b3::d35.35481 > fd7e:5a1e:b4b3:0:aca8:e98c:5918:f3d9.50532: Flags [P.], seq 1826:1846, ack 49, win 502, options [nop,nop,TS val 2992235193 ecr 166415415], length 20
09:06:30.584775 IP6 fd7e:5a1e:b4b3::d35.35481 > fd7e:5a1e:b4b3:0:aca8:e98c:5918:f3d9.50532: Flags [P.], seq 1846:1866, ack 49, win 502, options [nop,nop,TS val 2992235212 ecr 166415456], length 20
09:06:30.585704 78:8c:b5:ce:2f:d9 > ff:ff:ff:ff:ff:ff, RRCP-0x25 query
09:06:30.605212 IP6 fd7e:5a1e:b4b3::d35.35481 > fd7e:5a1e:b4b3:0:aca8:e98c:5918:f3d9.50532: Flags [P.], seq 1866:1886, ack 49, win 502, options [nop,nop,TS val 2992235233 ecr 166415456], length 20
09:06:30.625500 IP6 fd7e:5a1e:b4b3::d35.35481 > fd7e:5a1e:b4b3:0:aca8:e98c:5918:f3d9.50532: Flags [P.], seq 1886:1906, ack 49, win 502, options [nop,nop,TS val 2992235253 ecr 166415496], length 20
09:06:30.644730 IP6 fd7e:5a1e:b4b3::d35.35481 > fd7e:5a1e:b4b3:0:aca8:e98c:5918:f3d9.50532: Flags [P.], seq 1906:1926, ack 49, win 502, options [nop,nop,TS val 2992235272 ecr 166415496], length 20
09:06:30.665060 IP6 fd7e:5a1e:b4b3::d35.35481 > fd7e:5a1e:b4b3:0:aca8:e98c:5918:f3d9.50532: Flags [P.], seq 1926:1946, ack 49, win 502, options [nop,nop,TS val 2992235293 ecr 166415535], length 20
09:06:30.685299 IP6 fd7e:5a1e:b4b3::d35.35481 > fd7e:5a1e:b4b3:0:aca8:e98c:5918:f3d9.50532: Flags [P.], seq 1946:1966, ack 49, win 502, options [nop,nop,TS val 2992235313 ecr 166415535], length 20
09:06:30.704525 IP6 fd7e:5a1e:b4b3::d35.35481 > fd7e:5a1e:b4b3:0:aca8:e98c:5918:f3d9.50532: Flags [P.], seq 1966:1986, ack 49, win 502, options [nop,nop,TS val 2992235332 ecr 166415584], length 20
09:06:30.724912 IP6 fd7e:5a1e:b4b3::d35.35481 > fd7e:5a1e:b4b3:0:aca8:e98c:5918:f3d9.50532: Flags [P.], seq 1986:2006, ack 49, win 502, options [nop,nop,TS val 2992235353 ecr 166415584], length 20
09:06:30.745134 IP6 fd7e:5a1e:b4b3::d35.35481 > fd7e:5a1e:b4b3:0:aca8:e98c:5918:f3d9.50532: Flags [P.], seq 2006:2026, ack 49, win 502, options [nop,nop,TS val 2992235373 ecr 166415615], length 20
09:06:30.765382 IP6 fd7e:5a1e:b4b3::d35.35481 > fd7e:5a1e:b4b3:0:aca8:e98c:5918:f3d9.50532: Flags [P.], seq 2026:2046, ack 49, win 502, options [nop,nop,TS val 2992235393 ecr 166415615], length 20
09:06:30.784632 IP6 fd7e:5a1e:b4b3::d35.35481 > fd7e:5a1e:b4b3:0:aca8:e98c:5918:f3d9.50532: Flags [P.], seq 2046:2066, ack 49, win 502, options [nop,nop,TS val 2992235412 ecr 166415656], length 20
09:06:30.805028 IP6 fd7e:5a1e:b4b3::d35.35481 > fd7e:5a1e:b4b3:0:aca8:e98c:5918:f3d9.50532: Flags [P.], seq 2066:2086, ack 49, win 502, options [nop,nop,TS val 2992235433 ecr 166415656], length 20
09:06:30.825291 IP6 fd7e:5a1e:b4b3::d35.35481 > fd7e:5a1e:b4b3:0:aca8:e98c:5918:f3d9.50532: Flags [P.], seq 2086:2106, ack 49, win 502, options [nop,nop,TS val 2992235453 ecr 166415696], length 20
09:06:30.844532 IP6 fd7e:5a1e:b4b3::d35.35481 > fd7e:5a1e:b4b3:0:aca8:e98c:5918:f3d9.50532: Flags [P.], seq 2106:2126, ack 49, win 502, options [nop,nop,TS val 2992235472 ecr 166415696], length 20
09:06:30.864933 IP6 fd7e:5a1e:b4b3::d35.35481 > fd7e:5a1e:b4b3:0:aca8:e98c:5918:f3d9.50532: Flags [P.], seq 2126:2146, ack 49, win 502, options [nop,nop,TS val 2992235493 ecr 166415735], length 20
09:06:30.885201 IP6 fd7e:5a1e:b4b3::d35.35481 > fd7e:5a1e:b4b3:0:aca8:e98c:5918:f3d9.50532: Flags [P.], seq 2146:2166, ack 49, win 502, options [nop,nop,TS val 2992235513 ecr 166415735], length 20
09:06:30.905449 IP6 fd7e:5a1e:b4b3::d35.35481 > fd7e:5a1e:b4b3:0:aca8:e98c:5918:f3d9.50532: Flags [P.], seq 2166:2186, ack 49, win 502, options [nop,nop,TS val 2992235533 ecr 166415776], length 20
09:06:30.924932 IP6 fd7e:5a1e:b4b3::d35.35481 > fd7e:5a1e:b4b3:0:aca8:e98c:5918:f3d9.50532: Flags [P.], seq 2186:2206, ack 49, win 502, options [nop,nop,TS val 2992235553 ecr 166415776], length 20
09:06:30.945200 IP6 fd7e:5a1e:b4b3::d35.35481 > fd7e:5a1e:b4b3:0:aca8:e98c:5918:f3d9.50532: Flags [P.], seq 2206:2226, ack 49, win 502, options [nop,nop,TS val 2992235573 ecr 166415815], length 20
09:06:30.965447 IP6 fd7e:5a1e:b4b3::d35.35481 > fd7e:5a1e:b4b3:0:aca8:e98c:5918:f3d9.50532: Flags [P.], seq 2226:2246, ack 49, win 502, options [nop,nop,TS val 2992235593 ecr 166415815], length 20
09:06:30.984947 IP6 fd7e:5a1e:b4b3::d35.35481 > fd7e:5a1e:b4b3:0:aca8:e98c:5918:f3d9.50532: Flags [P.], seq 2246:2266, ack 49, win 502, options [nop,nop,TS val 2992235613 ecr 166415856], length 20
09:06:31.005250 IP6 fd7e:5a1e:b4b3::d35.35481 > fd7e:5a1e:b4b3:0:aca8:e98c:5918:f3d9.50532: Flags [P.], seq 2266:2286, ack 49, win 502, options [nop,nop,TS val 2992235633 ecr 166415856], length 20
09:06:31.025507 IP6 fd7e:5a1e:b4b3::d35.35481 > fd7e:5a1e:b4b3:0:aca8:e98c:5918:f3d9.50532: Flags [P.], seq 2286:2306, ack 49, win 502, options [nop,nop,TS val 2992235653 ecr 166415896], length 20
09:06:31.044854 IP6 fd7e:5a1e:b4b3::d35.35481 > fd7e:5a1e:b4b3:0:aca8:e98c:5918:f3d9.50532: Flags [P.], seq 2306:2326, ack 49, win 502, options [nop,nop,TS val 2992235672 ecr 166415896], length 20
09:06:31.065119 IP6 fd7e:5a1e:b4b3::d35.35481 > fd7e:5a1e:b4b3:0:aca8:e98c:5918:f3d9.50532: Flags [P.], seq 2326:2346, ack 49, win 502, options [nop,nop,TS val 2992235693 ecr 166415937], length 20
09:06:31.084725 IP6 fd7e:5a1e:b4b3::d35.35481 > fd7e:5a1e:b4b3:0:aca8:e98c:5918:f3d9.50532: Flags [P.], seq 2346:2366, ack 61, win 502, options [nop,nop,TS val 2992235712 ecr 166415970], length 20
09:06:31.084786 IP6 fd7e:5a1e:b4b3::d35.35481 > fd7e:5a1e:b4b3:0:aca8:e98c:5918:f3d9.50532: Flags [P.], seq 2366:2379, ack 61, win 502, options [nop,nop,TS val 2992235712 ecr 166415970], length 13
09:06:31.092004 IP6 fd7e:5a1e:b4b3::d35.35481 > fd7e:5a1e:b4b3:0:aca8:e98c:5918:f3d9.50532: Flags [F.], seq 2379, ack 62, win 502, options [nop,nop,TS val 2992235720 ecr 166415976], length 0
09:06:31.463176 ARP, Request who-has 192.168.253.4 tell 192.
```

**Comment by Zoxc** [comment]
Post the first 10 entries of `-n port 35481` on a successful run so we can see if that uses a single IP.

**Comment by richb-hanover** [comment]
More than 10 lines - no extra charge...

Bonus trace: Second batch of lines are from a failing session a couple minutes after the first session

```
deploy@rpi4:~$ sudo tcpdump -i eth0 -n port 35481
[sudo] password for deploy:
tcpdump: verbose output suppressed, use -v[v]... for full protocol decode
listening on eth0, link-type EN10MB (Ethernet), snapshot length 262144 bytes

==== worked ====

10:01:35.565533 IP6 fd7e:5a1e:b4b3:0:5758:451:6e8b:a707.33366 > fd7e:5a1e:b4b3::98a.35481: Flags [S], seq 1663401306, win 33120, options [mss 1440,sackOK,TS val 2340456745 ecr 0,nop,wscale 7], length 0
10:01:35.761754 IP6 fd7e:5a1e:b4b3::98a.35481 > fd7e:5a1e:b4b3:0:5758:451:6e8b:a707.33366: Flags [S.], seq 3160454994, ack 1663401307, win 64260, options [mss 1440,sackOK,TS val 1290987709 ecr 2340456745,nop,wscale 7], length 0
10:01:35.767226 IP6 fd7e:5a1e:b4b3:0:5758:451:6e8b:a707.33366 > fd7e:5a1e:b4b3::98a.35481: Flags [.], ack 1, win 259, options [nop,nop,TS val 2340456942 ecr 1290987709], length 0
10:01:35.767680 IP6 fd7e:5a1e:b4b3:0:5758:451:6e8b:a707.33366 > fd7e:5a1e:b4b3::98a.35481: Flags [P.], seq 1:25, ack 1, win 259, options [nop,nop,TS val 2340456942 ecr 1290987709], length 24
10:01:35.767728 IP6 fd7e:5a1e:b4b3::98a.35481 > fd7e:5a1e:b4b3:0:5758:451:6e8b:a707.33366: Flags [.], ack 25, win 502, options [nop,nop,TS val 1290987911 ecr 2340456942], length 0
10:01:35.767838 IP6 fd7e:5a1e:b4b3::98a.35481 > fd7e:5a1e:b4b3:0:5758:451:6e8b:a707.33366: Flags [P.], seq 1:25, ack 25, win 502, options [nop,nop,TS val 1290987912 ecr 2340456942], length 24
10:01:35.769081 IP6 fd7e:5a1e:b4b3:0:5758:451:6e8b:a707.33366 > fd7e:5a1e:b4b3::98a.35481: Flags [.], ack 25, win 259, options [nop,nop,TS val 2340456948 ecr 1290987912], length 0
10:01:35.769113 IP6 fd7e:5a1e:b4b3:0:5758:451:6e8b:a707.33366 > fd7e:5a1e:b4b3::98a.35481: Flags [P.], seq 25:37, ack 25, win 259, options [nop,nop,TS val 2340456948 ecr 1290987912], length 12
10:01:35.769444 IP6 fd7e:5a1e:b4b3::98a.35481 > fd7e:5a1e:b4b3:0:5758:451:6e8b:a707.33366: Flags [P.], seq 25:46, ack 37, win 502, options [nop,nop,TS val 1290987913 ecr 2340456948], length 21
10:01:35.770344 IP6 fd7e:5a1e:b4b3:0:5758:451:6e8b:a707.33366 > fd7e:5a1e:b4b3::98a.35481: Flags [P.], seq 37:49, ack 46, win 259, options [nop,nop,TS val 2340456950 ecr 1290987913], length 12
10:01:35.771526 IP6 fd7e:5a1e:b4b3:0:5758:451:6e8b:a707.47259 > fd7e:5a1e:b4b3::98a.35481: UDP, length 16
10:01:35.771672 IP6 fd7e:5a1e:b4b3::98a.35481 > fd7e:5a1e:b4b3:0:5758:451:6e8b:a707.33366: Flags [P.], seq 46:66, ack 49, win 502, options [nop,nop,TS val 1290987915 ecr 2340456950], length 20
10:01:35.771784 IP6 fd7e:5a1e:b4b3::98a.35481 > fd7e:5a1e:b4b3:0:5758:451:6e8b:a707.47259: UDP, length 16
10:01:35.780946 IP6 fd7e:5a1e:b4b3:0:5758:451:6e8b:a707.47259 > fd7e:5a1e:b4b3::98a.35481: UDP, length 16
10:01:35.781120 IP6 fd7e:5a1e:b4b3::98a.35481 > fd7e:5a1e:b4b3:0:5758:451:6e8b:a707.47259: UDP, length 16
10:01:35.791122 IP6 fd7e:5a1e:b4b3:0:5758:451:6e8b:a707.47259 > fd7e:5a1e:b4b3::98a.35481: UDP, length 16
10:01:35.791324 IP6 fd7e:5a1e:b4b3::98a.35481 > fd7e:5a1e:b4b3:0:5758:451:6e8b:a707.47259: UDP, length 16
10:01:35.791483 IP6 fd7e:5a1e:b4b3::98a.35481 > fd7e:5a1e:b4b3:0:5758:451:6e8b:a707.33366: Flags [P.], seq 66:134, ack 49, win 502, options [nop,nop,TS val 1290987935 ecr 2340456950], length 68
10:01:35.792474 IP6 fd7e:5a1e:b4b3:0:5758:451:6e8b:a707.33366 > fd7e:5a1e:b4b3::98a.35481: Flags [.], ack 134, win 259, options [nop,nop,TS val 2340456972 ecr 1290987915], length 0
10:01:35.800549 IP6 fd7e:5a1e:b4b3:0:5758:451:6e8b:a707.47259 > fd7e:5a1e:b4b3::98a.35481: UDP, length 16
10:01:35.800788 IP6 fd7e:5a1e:b4b3::98a.35481 > fd7e:5a1e:b4b3:0:5758:451:6e8b:a707.47259: UDP, length 16
10:01:35.810746 IP6 fd7e:5a1e:b4b3:0:5758:451:6e8b:a707.47259 > fd7e:5a1e:b4b3::98a.35481: UDP, length 16
10:01:35.810955 IP6 fd7e:5a1e:b4b3::98a.35481 > fd7e:5a1e:b4b3:0:5758:451:6e8b:a707.47259: UDP, length 16
10:01:35.812178 IP6 fd7e:5a1e:b4b3::98a.35481 > fd7e:5a1e:b4b3:0:5758:451:6e8b:a707.33366: Flags [P.], seq 134:186, ack 49, win 502, options [nop,nop,TS val 1290987956 ecr 2340456972], length 52
10:01:35.821256 IP6 fd7e:5a1e:b4b3:0:5758:451:6e8b:a707.47259 > fd7e:5a1e:b4b3::98a.35481: UDP, length 16
10:01:35.821585 IP6 fd7e:5a1e:b4b3::98a.35481 > fd7e:5a1e:b4b3:0:5758:451:6e8b:a707.47259: UDP, length 16
10:01:35.830558 IP6 fd7e:5a1e:b4b3:0:5758:451:6e8b:a707.47259 > fd7e:5a1e:b4b3::98a.35481: UDP, length 16
10:01:35.830653 IP6 fd7e:5a1e:b4b3::98a.35481 > fd7e:5a1e:b4b3:0:5758:451:6e8b:a707.47259: UDP, length 16
10:01:35.831873 IP6 fd7e:5a1e:b4b3::98a.35481 > fd7e:5a1e:b4b3:0:5758:451:6e8b:a707.33366: Flags [P.], seq 186:238, ack 49, win 502, options [nop,nop,TS val 1290987976 ecr 2340456972], length 52
10:01:35.832755 IP6 fd7e:5a1e:b4b3:0:5758:451:6e8b:a707.33366 > fd7e:5a1e:b4b3::98a.35481: Flags [.], ack 238, win 259, options [nop,nop,TS val 2340457012 ecr 1290987956], length 0
10:01:35.840823 IP6 fd7e:5a1e:b4b3:0:5758:451:6e8b:a707.47259 > fd7e:5a1e:b4b3::98a.35481: UDP, length 16
10:01:35.840979 IP6 fd7e:5a1e:b4b3::98a.35481 > fd7e:5a1e:b4b3:0:5758:451:6e8b:a707.47259: UDP, length 16
10:01:35.852211 IP6 fd7e:5a1e:b4b3::98a.35481 > fd7e:5a1e:b4b3:0:5758:451:6e8b:a707.33366: Flags [P.], seq 238:274, ack 49, win 502, options [nop,nop,TS val 1290987996 ecr 2340457012], length 36
10:01:35.861262 IP6 fd7e:5a1e:b4b3:0:5758:451:6e8b:a707.47259 > fd7e:5a1e:b4b3::98a.35481: UDP, length 16
10:01:35.861306 IP6 fd7e:5a1e:b4b3:0:5758:451:6e8b:a707.47259 > fd7e:5a1e:b4b3::98a.35481: UDP, length 16
10:01:35.861465 IP6 fd7e:5a1e:b4b3::98a.35481 > fd7e:5a1e:b4b3:0:5758:451:6e8b:a707.47259: UDP, length 16
10:01:35.861560 IP6 fd7e:5a1e:b4b3::98a.35481 > fd7e:5a1e:b4b3:0:5758:451:6e8b:a707.47259: UDP, length 16
10:01:35.870568 IP6 fd7e:5a1e:b4b3:0:5758:451:6e8b:a707.47259 > fd7e:5a1e:b4b3::98a.35481: UDP, length 16
10:01:35.870740 IP6 fd7e:5a1e:b4b3::98a.35481 > fd7e:5a1e:b4b3:0:5758:451:6e8b:a707.47259: UDP, length 16
10:01:35.872026 IP6 fd7e:5a1e:b4b3::98a.35481 > fd7e:5a1e:b4b3:0:5758:451:6e8b:a707.33366: Flags [P.], seq 274:342, ack 49, win 502, options [nop,nop,TS val 1290988016 ecr 2340457012], length 68
10:01:35.872918 IP6 fd7e:5a1e:b4b3:0:5758:451:6e8b:a707.33366 > fd7e:5a1e:b4b3::98a.35481: Flags [.], ack 342, win 259, options [nop,nop,TS val 2340457052 ecr 1290987996], length 0
10:01:35.880970 IP6 fd7e:5a1e:b4b3:0:5758:451:6e8b:a707.47259 > fd7e:5a1e:b4b3::98a.35481: UDP, length 16
10:01:35.881154 IP6 fd7e:5a1e:b4b3::98a.35481 > fd7e:5a1e:b4b3:0:5758:451:6e8b:a707.47259: UDP, length 16
10:01:35.891117 IP6 fd7e:5a1e:b4b3:0:5758:451:6e8b:a707.47259 > fd7e:5a1e:b4b3::98a.35481: UDP, length 16
10:01:35.891284 IP6 fd7e:5a1e:b4b3::98a.35481 > fd7e:5a1e:b4b3:0:5758:451:6e8b:a707.47259: UDP, length 16
10:01:35.891417 IP6 fd7e:5a1e:b4b3::98a.35481 > fd7e:5a1e:b4b3:0:5758:451:6e8b:a707.33366: Flags [P.], seq 342:394, ack 49, win 502, options [nop,nop,TS val 1290988035 ecr 2340457052], length 52
10:01:35.900814 IP6 fd7e:5a1e:b4b3:0:5758:451:6e8b:a707.47259 > fd7e:5a1e:b4b3::98a.35481: UDP, length 16
10:01:35.901026 IP6 fd7e:5a1e:b4b3::98a.35481 > fd7e:5a1e:b4b3:0:5758:451:6e8b:a707.47259: UDP, length 16
10:01:35.911116 IP6 fd7e:5a1e:b4b3:0:5758:451:6e8b:a707.47259 > fd7e:5a1e:b4b3::98a.35481: UDP, length 16
10:01:35.911332 IP6 fd7e:5a1e:b4b3::98a.35481 > fd7e:5a1e:b4b3:0:5758:451:6e8b:a707.47259: UDP, length 16
10:01:35.911468 IP6 fd7e:5a1e:b4b3::98a.35481 > fd7e:5a1e:b4b3:0:5758:451:6e8b:a707.33366: Flags [P.], seq 394:446, ack 49, win 502, options [nop,nop,TS val 1290988055 ecr 2340457052], length 52
10:01:35.912388 IP6 fd7e:5a1e:b4b3:0:5758:451:6e8b:a707.33366 > fd7e:5a1e:b4b3::98a.35481: Flags [.], ack 446, win 259, options [nop,nop,TS val 2340457092 ecr 1290988035], length 0

==== failed ====



10:05:16.330544 IP6 fd7e:5a1e:b4b3::d35.35481 > fd7e:5a1e:b4b3:0:5758:451:6e8b:a707.38568: Flags [S.], seq 2023168741, ack 605255767, win 64260, options [mss 1440,sackOK,TS val 2850565005 ecr 1298892373,nop,wscale 7], length 0
10:05:16.336539 IP6 fd7e:5a1e:b4b3::d35.35481 > fd7e:5a1e:b4b3:0:5758:451:6e8b:a707.38568: Flags [.], ack 25, win 502, options [nop,nop,TS val 2850565011 ecr 1298892418], length 0
10:05:16.336765 IP6 fd7e:5a1e:b4b3::d35.35481 > fd7e:5a1e:b4b3:0:5758:451:6e8b:a707.38568: Flags [P.], seq 1:25, ack 25, win 502, options [nop,nop,TS val 2850565011 ecr 1298892418], length 24
10:05:16.339121 IP6 fd7e:5a1e:b4b3::d35.35481 > fd7e:5a1e:b4b3:0:5758:451:6e8b:a707.38568: Flags [P.], seq 25:46, ack 37, win 502, options [nop,nop,TS val 2850565014 ecr 1298892421], length 21
10:05:16.343985 IP6 fd7e:5a1e:b4b3::98a.35481 > fd7e:5a1e:b4b3:0:5758:451:6e8b:a707.50903: UDP, length 16
10:05:16.345220 IP6 fd7e:5a1e:b4b3::d35.35481 > fd7e:5a1e:b4b3:0:5758:451:6e8b:a707.38568: Flags [P.], seq 46:82, ack 49, win 502, options [nop,nop,TS val 2850565020 ecr 1298892423], length 36
10:05:16.351949 IP6 fd7e:5a1e:b4b3::98a.35481 > fd7e:5a1e:b4b3:0:5758:451:6e8b:a707.50903: UDP, length 16
10:05:16.362085 IP6 fd7e:5a1e:b4b3::98a.35481 > fd7e:5a1e:b4b3:0:5758:451:6e8b:a707.50903: UDP, length 16
10:05:16.365347 IP6 fd7e:5a1e:b4b3::d35.35481 > fd7e:5a1e:b4b3:0:5758:451:6e8b:a707.38568: Flags [P.], seq 82:134, ack 49, win 502, options [nop,nop,TS val 2850565040 ecr 1298892423], length 52
10:05:16.378688 IP6 fd7e:5a1e:b4b3::98a.35481 > fd7e:5a1e:b4b3:0:5758:451:6e8b:a707.50903: UDP, length 16
10:05:16.382381 IP6 fd7e:5a1e:b4b3::98a.35481 > fd7e:5a1e:b4b3:0:5758:451:6e8b:a707.50903: UDP, length 16
10:05:16.384613 IP6 fd7e:5a1e:b4b3::d35.35481 > fd7e:5a1e:b4b3:0:5758:451:6e8b:a707.38568: Flags [P.], seq 134:186, ack 49, win 502, options [nop,nop,TS val 2850565059 ecr 1298892450], length 52
10:05:16.391545 IP6 fd7e:5a1e:b4b3::98a.35481 > fd7e:5a1e:b4b3:0:5758:451:6e8b:a707.50903: UDP, length 16
10:05:16.401831 IP6 fd7e:5a1e:b4b3::98a.35481 > fd7e:5a1e:b4b3:0:5758:451:6e8b:a707.50903: UDP, length 16
10:05:16.405116 IP6 fd7e:5a1e:b4b3::d35.35481 > fd7e:5a1e:b4b3:0:5758:451:6e8b:a707.38568: Flags [P.], seq 186:238, ack 49, win 502, options [nop,nop,TS val 2850565080 ecr 1298892450], length 52
10:05:16.411918 IP6 fd7e:5a1e:b4b3::98a.35481 > fd7e:5a1e:b4b3:0:5758:451:6e8b:a707.50903: UDP, length 16
10:05:16.422098 IP6 fd7e:5a1e:b4b3::98a.35481 > fd7e:5a1e:b4b3:0:5758:451:6e8b:a707.50903: UDP, length 16
10:05:16.425418 IP6 fd7e:5a1e:b4b3::d35.35481 > fd7e:5a1e:b4b3:0:5758:451:6e8b:a707.38568: Flags [P.], seq 238:290, ack 49, win 502, options [nop,nop,TS val 2850565100 ecr 1298892489], length 52
10:05:16.433669 IP6 fd7e:5a1e:b4b3::98a.35481 > fd7e:5a1e:b4b3:0:5758:451:6e8b:a707.50903: UDP, length 16
10:05:16.442306 IP6 fd7e:5a1e:b4b3::98a.35481 > fd7e:5a1e:b4b3:0:5758:451:6e8b:a707.50903: UDP, length 16
10:05:16.444580 IP6 fd7e:5a1e:b4b3::d35.35481 > fd7e:5a1e:b4b3:0:5758:451:6e8b:a707.38568: Flags [P.], seq 290:342, ack 49, win 502, options [nop,nop,TS val 2850565119 ecr 1298892489], length 52
10:05:16.452229 IP6 fd7e:5a1e:b4b3::98a.35481 > fd7e:5a1e:b4b3:0:5758:451:6e8b:a707.50903: UDP, length 16
10:05:16.462497 IP6 fd7e:5a1e:b4b3::98a.35481 > fd7e:5a1e:b4b3:0:5758:451:6e8b:a707.50903: UDP, length 16
10:05:16.464769 IP6 fd7e:5a1e:b4b3::d35.35481 > fd7e:5a1e:b4b3:0:5758:451:6e8b:a707.38568: Flags [P.], seq 342:394, ack 49, win 502, options [nop,nop,TS val 2850565139 ecr 1298892529], length 52
10:05:16.472520 IP6 fd7e:5a1e:b4b3::98a.35481 > fd7e:5a1e:b4b3:0:5758:451:6e8b:a707.50903: UDP, length 16
10:05:16.481790 IP6 fd7e:5a1e:b4b3::98a.35481 > fd7e:5a1e:b4b3:0:5758:451:6e8b:a707.50903: UDP, length 16
10:05:16.485214 IP6 fd7e:5a1e:b4b3::d35.35481 > fd7e:5a1e:b4b3:0:5758:451:6e8b:a707.38568: Flags [P.], seq 394:446, ack 49, win 502, options [nop,nop,TS val 2850565160 ecr 1298892529], length 52
10:05:16.491872 IP6 fd7e:5a1e:b4b3::98a.35481 > fd7e:5a1e:b4b3:0:5758:451:6e8b:a707.50903: UDP, length 16
10:05:16.502047 IP6 fd7e:5a1e:b4b3::98a.35481 > fd7e:5a1e:b4b3:0:5758:451:6e8b:a707.50903: UDP, length 16
10:05:16.505324 IP6 fd7e:5a1e:b4b3::d35.35481 > fd7e:5a1e:b4b3:0:5758:451:6e8b:a707.38568: Flags [P.], seq 446:498, ack 49, win 502, options [nop,nop,TS val 2850565180 ecr 1298892570], length 52
10:05:16.512076 IP6 fd7e:5a1e:b4b3::98a.35481 > fd7e:5a1e:b4b3:0:5758:451:6e8b:a707.50903: UDP, length 16
10:05:16.522236 IP6 fd7e:5a1e:b4b3::98a.35481 > fd7e:5a1e:b4b3:0:5758:451:6e8b:a707.50903: UDP, length 16
10:05:16.524505 IP6 fd7e:5a1e:b4b3::d35.35481 > fd7e:5a1e:b4b3:0:5758:451:6e8b:a707.38568: Flags [P.], seq 498:550, ack 49, win 502, options [nop,nop,TS val 2850565199 ecr 1298892570], length 52
10:05:16.532289 IP6 fd7e:5a1e:b4b3::98a.35481 > fd7e:5a1e:b4b3:0:5758:451:6e8b:a707.50903: UDP, length 16
10:05:16.544557 IP6 fd7e:5a1e:b4b3::d35.35481 > fd7e:5a1e:b4b3:0:5758:451:6e8b:a707.38568: Flags [P.], seq 550:586, ack 49, win 502, options [nop,nop,TS val 2850565219 ecr 1298892609], length 36
10:05:16.544629 IP6 fd7e:5a1e:b4b3::98a.35481 > fd7e:5a1e:b4b3:0:5758:451:6e8b:a707.50903: UDP, length 16
10:05:16.552318 IP6 fd7e:5a1e:b4b3::98a.35481 > fd7e:5a1e:b4b3:0:5758:451:6e8b:a707.50903: UDP, length 16
10:05:16.562304 IP6 fd7e:5a1e:b4b3::98a.35481 > fd7e:5a1e:b4b3:0:5758:451:6e8b:a707.50903: UDP, length 16
10:05:16.564526 IP6 fd7e:5a1e:b4b3::d35.35481 > fd7e:5a1e:b4b3:0:5758:451:6e8b:a707.38568: Flags [P.], seq 586:654, ack 49, win 502, options [nop,nop,TS val 2850565239 ecr 1298892609], length 68
10:05:16.572127 IP6 fd7e:5a1e:b4b3::98a.35481 > fd7e:5a1e:b4b3:0:5758:451:6e8b:a707.50903: UDP, length 16
...
```

**Comment by Zoxc** [comment]
Could you give https://github.com/Zoxc/crusader/tree/udp-spawn a try?

**Comment by richb-hanover** [comment]
I noticed an odd thing... I ran the experment three more times. In the sessions that worked, it appears that the session was initiated by the client. In the one that didn't work, it appears that the SERVER SPOKE FIRST. 

I think this means that the tcpdump is failing to capture some signal that started the second session. Any ideas? Thanks

Specifically... In the first test (that worked), the initial connection ([S] I believe) came from the client `a707`

```
11:37:17.254897 IP6 fd7e:5a1e:b4b3:0:5758:451:6e8b:a707.50984 > fd7e:5a1e:b4b3::98a.35481: Flags [S], seq 3488396440, win 33120, options [mss 1440,sackOK,TS val 2346198427 ecr 0,nop,wscale 7], length 0
11:37:17.255025 IP6 fd7e:5a1e:b4b3::98a.35481 > fd7e:5a1e:b4b3:0:5758:451:6e8b:a707.50984: Flags [S.], seq 4124269484, ack 3488396441, win 64260, options [mss 1440,sackOK,TS val 1296729399 ecr 2346198427,nop,wscale 7], length 0
11:37:17.256060 IP6 fd7e:5a1e:b4b3:0:5758:451:6e8b:a707.50984 > fd7e:5a1e:b4b3::98a.35481: Flags [.], ack 1, win 259, options [nop,nop,TS val 2346198428 ecr 1296729399], length 0
11:37:17.256175 IP6 fd7e:5a1e:b4b3:0:5758:451:6e8b:a707.50984 > fd7e:5a1e:b4b3::98a.35481: Flags [P.], seq 1:25, ack 1, win 259, options [nop,nop,TS val 2346198428 ecr 1296729399], length 24
```

In the next example that failed (started 30 seconds after the previous test), the SYN packet ([S.]) was sent TO `a707`, 

```
11:37:57.037348 IP6 fd7e:5a1e:b4b3::d35.35481 > fd7e:5a1e:b4b3:0:5758:451:6e8b:a707.36036: Flags [S.], seq 3770109572, ack 2964624365, win 64260, options [mss 1440,sackOK,TS val 2856125712 ecr 1304453062,nop,wscale 7], length 0
11:37:57.042329 IP6 fd7e:5a1e:b4b3::d35.35481 > fd7e:5a1e:b4b3:0:5758:451:6e8b:a707.36036: Flags [.], ack 25, win 502, options [nop,nop,TS val 2856125717 ecr 1304453116], length 0
11:37:57.042676 IP6 fd7e:5a1e:b4b3::d35.35481 > fd7e:5a1e:b4b3:0:5758:451:6e8b:a707.36036: Flags [P.], seq 1:25, ack 25, win 502, options [nop,nop,TS val 2856125717 ecr 1304453116], length 24
11:37:57.045164 IP6 fd7e:5a1e:b4b3::d35.35481 > fd7e:5a1e:b4b3:0:5758:451:6e8b:a707.36036: Flags [P.], seq 25:46, ack 37, win 502, options [nop,nop,TS val 2856125720 ecr 1304453119], length 21
11:37:57.047903 IP6 fd7e:5a1e:b4b3::d35.35481 > fd7e:5a1e:b4b3:0:5758:451:6e8b:a707.36036: Flags [P.], seq 46:66, ack 49, win 502, options [nop,nop,TS val 2856125723 ecr 1304453121], length 20
11:37:57.048029 IP6 fd7e:5a1e:b4b3::98a.35481 > fd7e:5a1e:b4b3:0:5758:451:6e8b:a707.45039: UDP, length 16
11:37:57.058434 IP6 fd7e:5a1e:b4b3::98a.35481 > fd7e:5a1e:b4b3:0:5758:451:6e8b:a707.45039: UDP, length 16
11:37:57.067880 IP6 fd7e:5a1e:b4b3::d35.35481 > fd7e:5a1e:b4b3:0:5758:451:6e8b:a707.36036: Flags [P.], seq 66:118, ack 49, win 502, options [nop,nop,TS val 2856125743 ecr 1304453121], length 52
11:37:57.068659 IP6 fd7e:5a1e:b4b3::98a.35481 > fd7e:5a1e:b4b3:0:5758:451:6e8b:a707.45039: UDP, length 16
11:37:57.078593 IP6 fd7e:5a1e:b4b3::98a.35481 > fd7e:5a1e:b4b3:0:5758:451:6e8b:a707.45039: UDP, length 16
```
In the third test (worked again), the initial SYN packet was sent by `a707`.

```
11:42:13.208299 IP6 fd7e:5a1e:b4b3:0:5758:451:6e8b:a707.46264 > fd7e:5a1e:b4b3::98a.35481: Flags [S], seq 2498423247, win 33120, options [mss 1440,sackOK,TS val 2346494380 ecr 0,nop,wscale 7], length 0
11:42:13.208442 IP6 fd7e:5a1e:b4b3::98a.35481 > fd7e:5a1e:b4b3:0:5758:451:6e8b:a707.46264: Flags [S.], seq 717768035, ack 2498423248, win 64260, options [mss 1440,sackOK,TS val 1297025352 ecr 2346494380,nop,wscale 7], length 0
11:42:13.209386 IP6 fd7e:5a1e:b4b3:0:5758:451:6e8b:a707.46264 > fd7e:5a1e:b4b3::98a.35481: Flags [.], ack 1, win 259, options [nop,nop,TS val 2346494381 ecr 1297025352], length 0
```

**Comment by richb-hanover** [comment]
> Could you give https://github.com/Zoxc/crusader/tree/udp-spawn a try?

I will do this, but won't have time 'til later this afternoon. Thanks

**Comment by richb-hanover** [comment]
Ahah! I have an explanation. And it's not a Crusader bug... Here's what I found:

```
$ nslookup rpi4.lan
Server:		127.0.0.53
Address:	127.0.0.53#53

Non-authoritative answer:
Name:	rpi4.lan
Address: 192.168.253.226
Name:	rpi4.lan
Address: fd7e:5a1e:b4b3::d35
Name:	rpi4.lan
Address: fd7e:5a1e:b4b3::98a
```
and that shows _two_ IPv6 addresses for `rpi4.lan`. My suspicion is that the local mDNS server is alternating between those two addresses, so it works one time, and not the next..

**Comment by Zoxc** [comment]
It's perfectly normal to have multiple IPv6 addresses though, so I'd still like to know if that branch fixes the issue.

**Comment by richb-hanover** [comment]
Yes, I know about multiple IPv6 addresses. The udp-spawn branch didn't address the problem. Note that the first test (to `::98a`) worked, the second (to `::d35`) didn't. 

Is there a way that Crusader server can listen on/respond from all the IPv6 addresses? (Or am I missing the point?)

Also note: I changed the `version = "0.0.11-udp-spawn"` line of _src/crusader-lib/Cargo.toml_ to include the branch name to differentiate between the two branches.

Thanks again

```
deploy@RPi5:~/Documents/src/crusader/src/target/release$ ./crusader test rpi4.lan
[2024.07.31 13:24:49] Client version 0.0.11-udp-spawn running
[2024.07.31 13:24:49] Connected to server [fd7e:5a1e:b4b3::98a]:35481
[2024.07.31 13:24:50] Latency to server 1.26 ms
[2024.07.31 13:24:52] Testing download...
[2024.07.31 13:24:58] Testing upload...
[2024.07.31 13:25:05] Testing both download and upload...
[2024.07.31 13:25:12] Writing data...
[2024.07.31 13:25:12] Saved raw data as data 2024.07.31 13-25-12.crr
[2024.07.31 13:25:12] Saved plot as plot 2024.07.31 13-25-12.png

deploy@RPi5:~/Documents/src/crusader/src/target/release$ ./crusader test rpi4.lan
[2024.07.31 13:25:14] Client version 0.0.11-udp-spawn running
[2024.07.31 13:25:14] Connected to server [fd7e:5a1e:b4b3::d35]:35481
thread 'main' panicked at crusader-lib/src/test.rs:1369:10:
called `Result::unwrap()` on an `Err` value: "Unable to measure latency to server"
note: run with `RUST_BACKTRACE=1` environment variable to display a backtrace
Aborted (core dumped)
```

**Comment by Zoxc** [comment]
What does the tcpdump (on the server) look like with failed case and the `udp-spawn` branch running as the server?

Does `./crusader test fd7e:5a1e:b4b3::d35` always fail while `./crusader test fd7e:5a1e:b4b3::98a` always works?

**Comment by richb-hanover** [comment]
Yes. Running the test to ::98a always works; using ::d35 always fails.

Note: In the second trace, the first packet is from ::d35 TO :a707

```
# This works - :a707 connects to ::98a

15:36:58.980463 IP6 fd7e:5a1e:b4b3:0:5758:451:6e8b:a707.57326 > fd7e:5a1e:b4b3::98a.35481: Flags [S], seq 3895112117, win 33120, options [mss 1440,sackOK,TS val 2360580154 ecr 0,nop,wscale 7], length 0
```


```
# This didn't work - ::d35 connects back to :a707

15:38:16.690475 IP6 fd7e:5a1e:b4b3::d35.35481 > fd7e:5a1e:b4b3:0:5758:451:6e8b:a707.36458: Flags [S.], seq 3600131196, ack 253655195, win 64260, options [mss 1440,sackOK,TS val 2870545365 ecr 1318872748,nop,wscale 7], length 0
```

Both client and server are using "udp-spawn"...

```
deploy@RPi5:~/Documents/src/crusader/src/target/release$ ./crusader test fd7e:5a1e:b4b3::98a
[2024.07.31 15:37:30] Client version 0.0.11-udp-spawn running
[2024.07.31 15:37:30] Connected to server [fd7e:5a1e:b4b3::98a]:35481
[2024.07.31 15:37:31] Latency to server 1.25 ms
[2024.07.31 15:37:33] Testing download...
[2024.07.31 15:37:40] Testing upload...
[2024.07.31 15:37:46] Testing both download and upload...
[2024.07.31 15:37:53] Writing data...
[2024.07.31 15:37:53] Saved raw data as data 2024.07.31 15-37-53.crr
[2024.07.31 15:37:53] Saved plot as plot 2024.07.31 15-37-53.png

deploy@RPi5:~/Documents/src/crusader/src/target/release$ ./crusader test fd7e:5a1e:b4b3::d35
[2024.07.31 15:38:03] Client version 0.0.11-udp-spawn running
[2024.07.31 15:38:03] Connected to server [fd7e:5a1e:b4b3::d35]:35481
thread 'main' panicked at crusader-lib/src/test.rs:1369:10:
called `Result::unwrap()` on an `Err` value: "Unable to measure latency to server"
note: run with `RUST_BACKTRACE=1` environment variable to display a backtrace
Aborted (core dumped)
```

**Comment by Zoxc** [comment]
I'd like more than a single line from the failed case. Things went wrong with the UDP packet previously.

**Comment by Zoxc** [comment]
Maybe add the server log too.

**Comment by richb-hanover** [comment]
> I'd like more than a single line from the failed case. Things went wrong with the UDP packet previously.

That's what confuses me - there isn't a "previous" packet captured by that tcdump command. That packet the server sends back to the client is the first one that was captured.

Should I used  a different tcpdump command? Thanks

**Comment by Zoxc** [comment]
It looks like I'm able to reproduce this by assigning the same IPv6 addresses locally.

**Comment by richb-hanover** [comment]
I think this is well and truly solved with version 0.0.12...

I also want to point out how much Crusader has improved recently. The new logging makes it easy to compare/correlate dumps; the single version number does too. I also noticed that you catch errors and display a "user-focused" message if the remote server's not running/testing wrong address. 

Thank you for this very slick tool!

```
deploy@rpi4:~/src/crusader/src/target/release$ ./crusader serve
[2024-08-01 07:58:07] Server version 0.0.12 running...
[2024-08-01 07:58:22] Serving [fd7e:5a1e:b4b3:0:5758:451:6e8b:a707]:50064, version 3
[2024-08-01 07:58:22] Starting UDP server (fd7e:5a1e:b4b3::d35)
[2024-08-01 07:58:51] Serving complete for [fd7e:5a1e:b4b3:0:5758:451:6e8b:a707]:50064
[2024-08-01 07:59:12] Serving [fd7e:5a1e:b4b3:0:5758:451:6e8b:a707]:55812, version 3
[2024-08-01 07:59:12] Starting UDP server (fd7e:5a1e:b4b3::98a)
[2024-08-01 07:59:35] Serving complete for [fd7e:5a1e:b4b3:0:5758:451:6e8b:a707]:55812
[2024-08-01 08:01:04] Serving 192.168.253.154:43722, version 3
[2024-08-01 08:01:04] Starting UDP server (192.168.253.226)
[2024-08-01 08:01:27] Serving complete for 192.168.253.154:43722
```

```
deploy@RPi5:~/Documents/src/crusader/src/target/release$ ./crusader test fd7e:5a1e:b4b3::d35
[2024-08-01 07:58:22] Client version 0.0.12 running
[2024-08-01 07:58:22] Connected to server [fd7e:5a1e:b4b3::d35]:35481
[2024-08-01 07:58:24] Latency to server 2.11 ms
[2024-08-01 07:58:26] Testing download...
[2024-08-01 07:58:32] Testing upload...
[2024-08-01 07:58:39] Testing both download and upload...
[2024-08-01 07:58:51] Warning: Load termination timed out. There may be residual untracked traffic in the background.
[2024-08-01 07:58:51] Writing data...
[2024-08-01 07:58:51] Saved raw data as data 2024.08.01 07-58-51.crr
[2024-08-01 07:58:51] Saved plot as plot 2024.08.01 07-58-51.png
deploy@RPi5:~/Documents/src/crusader/src/target/release$ ./crusader test fd7e:5a1e:b4b3::98a
[2024-08-01 07:59:12] Client version 0.0.12 running
[2024-08-01 07:59:12] Connected to server [fd7e:5a1e:b4b3::98a]:35481
[2024-08-01 07:59:14] Latency to server 1.33 ms
[2024-08-01 07:59:16] Testing download...
[2024-08-01 07:59:22] Testing upload...
[2024-08-01 07:59:28] Testing both download and upload...
[2024-08-01 07:59:35] Writing data...
[2024-08-01 07:59:35] Saved raw data as data 2024.08.01 07-59-35.crr
[2024-08-01 07:59:35] Saved plot as plot 2024.08.01 07-59-35.png
deploy@RPi5:~/Documents/src/crusader/src/target/release$ ./crusader test 192.168.253.154
[2024-08-01 08:00:52] Client version 0.0.12 running
[2024-08-01 08:00:52] Client failed: Connection refused (os error 111)
deploy@RPi5:~/Documents/src/crusader/src/target/release$ ./crusader test 192.168.253.226
[2024-08-01 08:01:04] Client version 0.0.12 running
[2024-08-01 08:01:04] Connected to server 192.168.253.226:35481
[2024-08-01 08:01:06] Latency to server 1.29 ms
[2024-08-01 08:01:08] Testing download...
[2024-08-01 08:01:14] Testing upload...
[2024-08-01 08:01:20] Testing both download and upload...
[2024-08-01 08:01:27] Writing data...
[2024-08-01 08:01:27] Saved raw data as data 2024.08.01 08-01-27.crr
[2024-08-01 08:01:27] Saved plot as plot 2024.08.01 08-01-27.png
```

**Comment by richb-hanover** [comment]
Closing this issue. Thanks again!
